,tweet,emotion,pre_clean_len,clean_text
2174,Join @Buzz_dont_tweet &amp; @PlymouthMuseum for a #WildAboutPlymouth Big Bug Hunt on 11th July https://t.co/QojUQp1WO9 #Plymouth,nocode,128,join for a wildaboutplymouth big bug hunt on th july plymouth
2175,"""@tateliverpool: We are transforming our café special evening performances of Pollock inspired jazz http://t.co/vyPchjC26i""@TracyJHulse",nocode,135,we are transforming our caf special evening performances of pollock inspired jazz
2176,@Asamsakti   #ArtTherapy   Rubens  Samson and Delilah   1609-10  @NationalGallery    London,nocode,91,arttherapy rubens samson and delilah london
2177,BritishMuseum: RT @divaSTW: All I can say is WOW - @britishmuseum: Your groundbreaking #8mummies exhibition is fan… http://t.co/L0tbP9GItj,happy,138,britishmuseum rt all i can say is wow your groundbreaking mummies exhibition is fan
2178,"@NationalGallery The 2nd GENOCIDE against #Biafrans as promised by #Buhari has begun,3days of unreported aerial Bombardment in #Biafraland",not-relevant,138,the nd genocide against biafrans as promised by buhari has begun days of unreported aerial bombardment in biafraland
2179,@JillyEdwards1 @Tate_StIves is it Tracy Kendall wallpaper?,nocode,58,is it tracy kendall wallpaper
2180,@NationalGallery #AskTheGallery what are the most difficult audiences you have ever reached actively- and why and how?,nocode,118,askthegallery what are the most difficult audiences you have ever reached actively and why and how
2181,@britishmuseum @aroberts_andrew Any pictures of Gebhard Leberecht von Blucher flag? #Waterloo200 #BonaparteAndTheBritish,nocode,120,any pictures of gebhard leberecht von blucher flag waterloo bonaparteandthebritish
2182,"Celebrating Africa season, visit the exhibition The Sudanese lyre at @britishmuseum http://t.co/bHJziSiCsr",nocode,106,celebrating africa season visit the exhibition the sudanese lyre at
2183,Ketaki Sheth's photos of the Sidi people are absolutely amazing. @NationalGallery http://t.co/8mG39uBRSs,happy,104,ketaki sheth s photos of the sidi people are absolutely amazing
2184,Today I decided not to renew my @britishmuseum membership after being shouted at by one of their spaniards.,angry,107,today i decided not to renew my membership after being shouted at by one of their spaniards
2185,Booked on to What's it Worth? The Value and Potential of the CDA @britishmuseum 27 July. Shld be an interesting day! http://t.co/kjtXnbSJOA,happy,139,booked on to what s it worth the value and potential of the cda july shld be an interesting day
2186,The @NationalGallery curatorial trainee @HelenHillyard relaunches the Baroque Galleries at @BM_AG tomorrow!  http://t.co/zUumaE2Bdf,nocode,131,the curatorial trainee relaunches the baroque galleries at tomorrow
2187,@ObservatorioH Seis da manhã em Outubro... Maldição! @britishmuseum,nocode,67,seis da manh em outubro maldi o
2188,'Where to see Hepworth' via @MailOnline feat. @HepworthGallery @YSPsculpture @PierArtsCentre @Tate &amp; @Tate_StIves http://t.co/yZq8SQAAbS,nocode,140,where to see hepworth via feat
2189,@HenriNiotou @guardian @tateliverpool http://t.co/zMuxQEZYrb,nocode,60,
2190,@lapsedarchaeo @RAMMuseum @DurhamRDerby @a_seifertova @AnthropologyTip Thank you!,happy,81,thank you
2191,"An early tool from ancient Rome, similar to a Swiss Army knife, is on display at the @FitzMuseum_UK in Cambridge: http://t.co/Avqx2fX287",nocode,136,an early tool from ancient rome similar to a swiss army knife is on display at the in cambridge
2192,French 18th century room (33) re-opened @NationalGallery with reinstated dome and natural light- fantastic! http://t.co/4Otam6N2Bo,happy,130,french th century room re opened with reinstated dome and natural light fantastic
2193,@wmarybeard Just saw #DefiningBeauty @britishmuseum. How was disability represented/perceived in Classical Greece?,nocode,114,just saw definingbeauty how was disability represented perceived in classical greece
2194,Children's Commission @_TheWhiteChapel .Rivane Neuenschwander 's work of children's fears in London. #Adultfears http://t.co/TL1kVO5EDq,nocode,135,children s commission rivane neuenschwander s work of children s fears in london adultfears
2195,@britishmuseum #IndigenousAustralian Petroglyphs 5 TIMES OLDER than #Stonehenge being destroyed http://t.co/EDQRlKItkr #Woodside - $45B LNG,not-relevant,139,indigenousaustralian petroglyphs times older than stonehenge being destroyed woodside b lng
2196,"Dr Jago Cooper from @britishmuseum will be @uniofleicester's #PGRFest keynote speaker, speaking on ‘The Power of Research’!",nocode,123,dr jago cooper from will be s pgrfest keynote speaker speaking on the power of research
2197,@britishmuseum #hearingaccess inspires role models for people with hearing loss. http://t.co/fNoDpOEZ0W,happy,103,hearingaccess inspires role models for people with hearing loss
2198,MPs debated planned privatisation @NationalGallery yesterday as #PCS members continue their latest 10-day strike. https://t.co/RhL7xynqu5,nocode,137,mps debated planned privatisation yesterday as pcs members continue their latest day strike
2199,In Conversation: with Alan Cotton &amp; David Hempleman-Adams next Thursday via @ICIABath . Come along! https://t.co/Ua1IjqJx3s,happy,127,in conversation with alan cotton david hempleman adams next thursday via come along
2200,Distance makes the heart grow fonder but already heartbroken @kettlesyard shutting for 2 yr refurb on 21Jun; go now❤️ http://t.co/7HMmPRcJtz,sad,140,distance makes the heart grow fonder but already heartbroken shutting for yr refurb on jun go now
2201,"River Stars Reindeer exhibit at @MAACambridge, taking photos back to community &amp; getting their responses is great. http://t.co/HoSY74V8jk",happy,141,river stars reindeer exhibit at taking photos back to community getting their responses is great
2202,#FF #FollowFriday @GTroopRHA @sinonevero @suzilove @ThelmaHulbert @MartynPrice3 @LansonLoyalty @AntiqueMag @BHL_valuer @trueyankees,nocode,131,ff followfriday
2203,At @britishmuseum — https://t.co/TAjlY6JGim,nocode,43,at
2204,"Hello from Jerwood Gallery, Hastings! Dr Penny what is your favourite Modern British work in the @NationalGallery Collection? #AskTheGallery",nocode,140,hello from jerwood gallery hastings dr penny what is your favourite modern british work in the collection askthegallery
2205,Construction steams ahead Tate St Ives phase 2 @Tate_StIves @ILoveCornwallUK @BAMConstructUK http://t.co/X8q5ERGehi http://t.co/CKw68LfGP7,nocode,138,construction steams ahead tate st ives phase
2206,Born #OnThisDay 1577: #PeterPaulReubens. The Fall of the Damned (1620). @ArtCorgi @britishmuseum #art #AltePinakothek http://t.co/FRSb8064UF,nocode,140,born onthisday peterpaulreubens the fall of the damned art altepinakothek
2207,"I'm at @NationalGallery in London, Greater London https://t.co/xgYJI4H1KK",nocode,73,i m at in london greater london
2208,"I'm a music #artist who loves her #food. If u ever come to #London, have one of these @NationalGallery #foodie #eat http://t.co/8Pl6wXfw4x",happy,138,i m a music artist who loves her food if u ever come to london have one of these foodie eat
2209,Rarely seen watercolour treasures go on display at @FitzMuseum_UK - @chrismannbbc 17:45 http://t.co/LS0c6wQ3Do http://t.co/1ssIN2LwTw,nocode,133,rarely seen watercolour treasures go on display at
2210,The Cheeky Spouse Daily is out! http://t.co/fvlc2O2AqG Stories via @Buy_Natural @kettlesyard @TastesofAnglia,nocode,108,the cheeky spouse daily is out stories via
2211,Today our 2 interns visited @britishmuseum to reunite our archive documents with objects distributed over 133 years. http://t.co/o04gqbjETf,nocode,139,today our interns visited to reunite our archive documents with objects distributed over years
2212,"Davvero bella quest'opera , grazie Dil @Asamsakti  Benvenuto Tisi A Pagan Sacrifice  1526 @NationalGallery  London UK",nocode,117,davvero bella quest opera grazie dil benvenuto tisi a pagan sacrifice london uk
2213,Spent the day getting lost in the museums of Cambridge especially @MAACambridge what an amazing collection http://t.co/85jFiRrCHb,happy,129,spent the day getting lost in the museums of cambridge especially what an amazing collection
2214,View of L’Estaque by Cézanne at risk of being exported @FitzMuseum_UK unless a buyer can match the £13m asking price. http://t.co/F3qTEMqha7,sad,140,view of l estaque by c zanne at risk of being exported unless a buyer can match the m asking price
2215,"@britishmuseum, @el_pais said:Napoleón arengaba a esta hora a sus tropas preocupado por si el barro dejaría mover los cañones #Waterloo200",not-relevant,138,said napole n arengaba a esta hora a sus tropas preocupado por si el barro dejar a mover los ca ones waterloo
2216,"Top work by the exhibitions team and all @tateliverpool on a great summer season. Check out Pollock, Ligon and Bratescu, PV tonight!",happy,132,top work by the exhibitions team and all on a great summer season check out pollock ligon and bratescu pv tonight
2217,@Ophiolatrist @britishmuseum Nicer girlfriend?,nocode,46,nicer girlfriend
2218,"Faience vessel from @TheEES excavations at Sesebi, at the @britishmuseum! #Nubia #Sesebi http://t.co/SP3VOFfAjQ",happy,111,faience vessel from excavations at sesebi at the nubia sesebi
2219,More beauties from @NationalGallery. #trafalgarsquare #londonvacation #artgoestotheheart http://t.co/nyOWf1KU7p,happy,111,more beauties from trafalgarsquare londonvacation artgoestotheheart
2220,"@tatteredstones @kettlesyard It has long been on list to visit. Oh well, will have to be patient.",nocode,97,it has long been on list to visit oh well will have to be patient
2221,Read our new article about #Periscope &amp; @britishmuseum at http://t.co/Tbiw15AhR9 https://t.co/CRdQAKOuJt,nocode,108,read our new article about periscope at
2222,"@psframes @nationalgallery  Fía en tu duro, más que en amigo ninguno.",nocode,69,f a en tu duro m s que en amigo ninguno
2223,#WeekendGuide tomorrow 4pm @ArtBasel go see the discussion on Cross Cultural Exchange with @DCAMindia  @_TheWhitechapel and more,nocode,128,weekendguide tomorrow pm go see the discussion on cross cultural exchange with and more
2224,30 mayo 1887 se descubre el primer sarcófago #fenicio de  #Gadir -#Cadiz (s.IV a.C.) @ahencyclopedia @britishmuseum http://t.co/YIYQsNSNHr,nocode,138,mayo se descubre el primer sarc fago fenicio de gadir cadiz s iv a c
2225,@museiincomune @MarDixon @TCDArtCurator @leCMN @louvrepourtous @MuseeLouvre @britishmuseum @AlcaMaglie @ITweetMuseums @svegliamuseo ahahaha,nocode,139,ahahaha
2226,Unfortunately the transition narrative parts of those stories were handwaved away in the commentary. @foxvertebrae @britishmuseum,sad,129,unfortunately the transition narrative parts of those stories were handwaved away in the commentary
2227,@Libby_Brodie @NationalGallery happy birthday libby xx,nocode,54,happy birthday libby xx
2228,A taste for honey: bees in African rock art http://t.co/2hgK9sNrcl via @britishmuseum,nocode,85,a taste for honey bees in african rock art via
2229,@pcs_union @CliffordRoger @NationalGallery craigavon trades council sends a message of solidarity,nocode,97,craigavon trades council sends a message of solidarity
2230,Start your @_TheWhitechapel #FirstThursday at Ceviche Old St Gallery from 6pm next week: http://t.co/NcgIr6b1zX http://t.co/e0PJX5t4DK,nocode,134,start your firstthursday at ceviche old st gallery from pm next week
2231,@NationalGallery @BohanRob  it's very beautiful and creative painting,happy,69,it s very beautiful and creative painting
2232,@schemaly @britishmuseum Sounds to me like #FemalePrivilege is making them take their time.  #EverydaySexism,nocode,108,sounds to me like femaleprivilege is making them take their time everydaysexism
2233,@britishmuseum  : Cover Ulysses-nya Joyce karya Matisse : http://t.co/IoubnWlnCB,nocode,80,cover ulysses nya joyce karya matisse
2234,Volunteers needed for ARTIST ROOMS: Gerhard Richter @PlymouthMuseum http://t.co/8leTEA8rUs Deadline: Thurs 3 Sept #artopps,nocode,122,volunteers needed for artist rooms gerhard richter deadline thurs sept artopps
2235,"@britishmuseum, is that the Mold gold cape in the first pic, or am I mistaken?",nocode,78,is that the mold gold cape in the first pic or am i mistaken
2236,#JanVanEyck: Hombre con turbante.1433 @NationalGallery http://t.co/Aj3WGqVgKh,nocode,77,janvaneyck hombre con turbante
2237,1/2 Record @britishmuseum of 18th cent conversation in #Australia. British soldier &amp; #Aboriginal woman Patyegarang... http://t.co/43qYCvgmEJ,nocode,144,record of th cent conversation in australia british soldier aboriginal woman patyegarang
2238,"We've joined Instagram. Follow us to stop, look, discover, and share: http://t.co/dbLFe... http://t.co/XF3sbMVN4s via @NationalGallery",not-relevant,134,we ve joined instagram follow us to stop look discover and share via
2239,"Rehearsing for my British Museum show July 12. Performance Drawing, durational. #art @britishmuseum  @artlicks  @shubbakfestival  #egyptart",nocode,139,rehearsing for my british museum show july performance drawing durational art egyptart
2240,"The first owner of Cézanne's 'The Stove in the Studio' was his boyhood friend, Emile Zola... http://t.co/Jp3zomiPg1 via @NationalGallery",nocode,136,the first owner of c zanne s the stove in the studio was his boyhood friend emile zola via
2241,Lovely to see the house at @kettlesyard this morning for a final peek! #cambridge #art http://t.co/caOUtxdWwW,happy,109,lovely to see the house at this morning for a final peek cambridge art
2242,It's wine o'clock at the National Cafe with oliverpeyton @nationalgallery tonight - half price wine… https://t.co/7ZkZTnrXSj,nocode,124,it s wine o clock at the national cafe with oliverpeyton tonight half price wine
2243,Looking forward to the soundscapes exhibition at the @NationalGallery in July: http://t.co/2dv3wDk9H7,happy,101,looking forward to the soundscapes exhibition at the in july
2244,Happy Birthday #Rubens - #Samson and Delilah @NationalGallery - sexiest painting in the world! That #purple drapery! http://t.co/m5xvIkZEdy,happy,139,happy birthday rubens samson and delilah sexiest painting in the world that purple drapery
2245,@caitlinrgreen  @britishmuseum Real significance of  Arabic Mint in England in revealing European Islamic past http://t.co/IBmc7ywZpo,nocode,133,real significance of arabic mint in england in revealing european islamic past
2246,Great @NationalGallery #BaroqueSSN study day at @BM_AG discussing the gallery's fantastic new rehang &amp; visitor engagement with 17C art,nocode,138,great baroquessn study day at discussing the gallery s fantastic new rehang visitor engagement with c art
2247,Enjoyed our visit to the @britishmuseum today! http://t.co/hpsbNGZsxU,happy,69,enjoyed our visit to the today
2248,#speechless #IngmarBergman #silence #tystnaden 1963 @SMGUT @guillermosolana @museothyssen @NationalGallery http://t.co/pAJuehLRfr,nocode,129,speechless ingmarbergman silence tystnaden
2249,"Tonight, head to @_TheWhitechapel for a talk on 'Theatricality in Contemporary Art &amp; Stage Design' http://t.co/Z1pQhkbWCv",nocode,125,tonight head to for a talk on theatricality in contemporary art stage design
2250,Tokens designed + made ready for new Egyptian Tours starting @RAMMuseum this Sat. Get yrs from reception on the day http://t.co/ArwbF00Txp,nocode,138,tokens designed made ready for new egyptian tours starting this sat get yrs from reception on the day
2251,@CelesteRegal Ancient beauty is much more dependable...:) (thank you for retweeting)... :) @NationalGallery,happy,107,ancient beauty is much more dependable thank you for retweeting
2252,British Museum @britishmuseum #photography #streetphotography http://t.co/muH4CANaSw,nocode,84,british museum photography streetphotography
2253,@ydalycul @PaulKindersley @NTHepburn @kettlesyard I'm not sure if this is the same Christopher Wood...,nocode,102,i m not sure if this is the same christopher wood
2254,@CamUnivMuseums - this looks like a brilliant summer programme!,happy,63,this looks like a brilliant summer programme
2255,@britishmuseum That's cool!,happy,27,that s cool
2256,"Cornelis Visscher: ""The Large Cat,"" an engraving. The Netherlands, 1657. http://t.co/bsaU4S7jDb @britishmuseum http://t.co/VnPgJqQ50S",nocode,133,cornelis visscher the large cat an engraving the netherlands
2257,@NationalGallery How do you think curators can keep traditional art relevant in a contemporary age? #AskTheGallery https://t.co/2NDYvOfs1a,nocode,138,how do you think curators can keep traditional art relevant in a contemporary age askthegallery
2258,Alan Cotton &amp; David Hempleman-Adams here on campus at The Edge this Thursday. Come along https://t.co/Ua1Ijr17V0 @ICIABath,nocode,126,alan cotton david hempleman adams here on campus at the edge this thursday come along
2259,"#IndigenousAustralia exhibition @britishmuseum is powerful and moving. Importantly, it doesn't gloss over the evils of colonialism. See it.",happy,139,indigenousaustralia exhibition is powerful and moving importantly it doesn t gloss over the evils of colonialism see it
2260,Face the Music! http://t.co/rJ8FydmuEq 100s contrib. inc. @G_lizlulu @kettlesyard @DanielleMarieMu,happy,98,face the music s contrib inc
2261,@BonVoyageurs @britishmuseum fitting that Fathers Day is also the longest day,not-relevant,77,fitting that fathers day is also the longest day
2262,MT“@britishmuseum: It's the longest day in northern hemisphere: #SummerSolstice at Stonehenge http://t.co/nWSMpUCTba http://t.co/wMddH2oo4u”,nocode,140,mt it s the longest day in northern hemisphere summersolstice at stonehenge
2263,@PrisonHorsens @museum140 thanks! @NationalGallery just got on IG yesterday as @national_gallery. Thats a must-follow,happy,117,thanks just got on ig yesterday as thats a must follow
2264,"Our review of @britishmuseum's new Rothschild Renaissance gallery: ""Challenging &amp; intriguing"" http://t.co/LQE4nzQVhB http://t.co/DXvWb5JbSV",happy,143,our review of s new rothschild renaissance gallery challenging intriguing
2265,Found some pretty old @britishmuseum web design work http://t.co/UpB5EYm2B9,nocode,75,found some pretty old web design work
2266,Very excited for the Jackson Pollock press viewing @tateliverpool today! #sneakpeek,happy,83,very excited for the jackson pollock press viewing today sneakpeek
2267,@nautilusnat @CamUnivMuseums @ZoologyMuseum Hello and thank you for the warm welcome!,happy,85,hello and thank you for the warm welcome
2268,#askthegallery How much public money have you spend on brining in CIS scabs during the current PCS dispute? @NationalGallery,angry,124,askthegallery how much public money have you spend on brining in cis scabs during the current pcs dispute
2269,"I'm at @NationalGallery in London, Greater London https://t.co/wInooFg98s",nocode,73,i m at in london greater london
2270,Together we can climb every mountain @StIvesSch @Tate_StIves   https://t.co/8hIXAKK8Rd.  http://t.co/fPJcyJBnVJ http://t.co/FTU3c4YstK,nocode,134,together we can climb every mountain
2271,"Great opportunity to see Russian artist Arseny Zhilyaev at @_TheWhitechapel this Thurs, who's on show @la_Biennale http://t.co/t1fZx0gcPx",happy,137,great opportunity to see russian artist arseny zhilyaev at this thurs who s on show
2272,Greek Sculpture @britishmuseum. Learn more about out AW15 inspiration on the journal  http://t.co/DKGuz0cchD http://t.co/AHDupAxg7z,nocode,131,greek sculpture learn more about out aw inspiration on the journal
2273,Saw this @britishmuseum and thought of you @Chicken_project http://t.co/Q331VPoNqR http://t.co/TRfSwe1MBk,nocode,105,saw this and thought of you
2274,Please still come down we are open until 5pm today we would love to see you. #CastleHill15 @CambridgeNewsUK @kettlesyard,happy,120,please still come down we are open until pm today we would love to see you castlehill
2275,'visually striking compilation' great blog @curatedjenny on RiverStarsReindeer @MAACambridge https://t.co/ToVrGcMizu http://t.co/HAxAISXabz,happy,139,visually striking compilation great blog on riverstarsreindeer
2276,From The Tomb Of #Nebamun — 1350 BC | #Egyptology #Archaeology #AncientEgypt @britishmuseum http://t.co/2KxSE2glig,nocode,114,from the tomb of nebamun bc egyptology archaeology ancientegypt
2277,Finally made it to @britishmuseum #AncientLives #8mummies. Another stunning triumph of the fab @NISSENRICHARDS studio http://t.co/Oq4BgeOe8v,happy,140,finally made it to ancientlives mummies another stunning triumph of the fab studio
2278,Ethel Maude collective (includes me!) screening in the Luminous Latitudes programme @_TheWhitechapel Thurs 9 July http://t.co/mCWfWFNg1C,nocode,136,ethel maude collective includes me screening in the luminous latitudes programme thurs july
2279,http://t.co/E4ktdgnt8N @tateliverpool @cheshirelife @DBakerGallery @ShopCheshireUK,nocode,82,
2280,"@MartinUMueller Stimmt wohl, vielleicht müsste ein Dan Brown seinen Langdon ins Pergamon schicken? @DerSPIEGEL @MuseeLouvre @britishmuseum",nocode,138,stimmt wohl vielleicht m sste ein dan brown seinen langdon ins pergamon schicken
2281,FAB Liverpool package Jackson Pollock: Blind Spots @tateliverpool + @hotelindigo + voucher #dazzleferry do pick it up @TravelBird_UK,nocode,132,fab liverpool package jackson pollock blind spots voucher dazzleferry do pick it up
2282,@MuseeLouvre @museiincomune @leCMN @GoldUnveiled @britishmuseum @MarDixon @Museo_MADRE  magnifique et émouvant !,not-relevant,112,magnifique et mouvant
2283,"@macpowell @NationalGallery, @Hirshhorn on the mall and many many many others.",nocode,78,on the mall and many many many others
2284,"As a visitor low on cash, I was glad to see this prominent, but tasteful, text-to-give sign at the @britishmuseum http://t.co/oREcDlQ0tu",happy,136,as a visitor low on cash i was glad to see this prominent but tasteful text to give sign at the
2285,Beauty and beastliness in ancient Greece: http://t.co/ef2NOv78Sq (about @britishmuseum #DefiningBeauty),nocode,103,beauty and beastliness in ancient greece about definingbeauty
2286,Pebble fancier and Tate curator in the 30s:Jim Ede's collection of stray objects and art @kettlesyard - beautiful. http://t.co/o3Cy7SSa3Y,happy,137,pebble fancier and tate curator in the s jim ede s collection of stray objects and art beautiful
2287,British Prints and Propaganda Exhibition in age of #Napoleon @britishmuseum Feb 2-Aug 16 2015 http://t.co/pLWp7PC91q http://t.co/MX1eASqqXX,nocode,139,british prints and propaganda exhibition in age of napoleon feb aug
2288,@museum140 false alarm - sorry!  I've got it working on another device now.   will add @CamUnivMuseums to the list,not-relevant,114,false alarm sorry i ve got it working on another device now will add to the list
2289,"Great end to my time @MAACambridge: cake, a performance from the Zugubal dancers of the Torres Strait, and these! http://t.co/Fn7DLB0oc9",happy,136,great end to my time cake a performance from the zugubal dancers of the torres strait and these
2290,“@CharleJHuguenin: #Velazquez Vénus exposée actuellement à Paris mais habituellement à la @NationalGallery http://t.co/S8eVJc1kUu”,nocode,130,velazquez v nus expos e actuellement paris mais habituellement la
2291,"@MartinUMueller Vielleicht ist das britische, kostenlose Modell ein Modell? @DerSPIEGEL @MuseeLouvre @britishmuseum",nocode,115,vielleicht ist das britische kostenlose modell ein modell
2292,@psframes enjoyed the Sansovino Frames! @NationalGallery http://t.co/SPCVtC15Lt,happy,79,enjoyed the sansovino frames
2293,Are the Rothschild bronzes by #Michelangelo?@FitzMuseum_UK is holding a conference to find out http://t.co/KkKzKt7idf http://t.co/vElV09jfPc,nocode,140,are the rothschild bronzes by michelangelo is holding a conference to find out
2294,"@JohnConstableRA @NationalGallery Thank you, Sir!",happy,49,thank you sir
2295,Today's 'A Monochrome Dream' is out! http://t.co/q1KuG67YiV Stories via @_TheWhitechapel @noukkasigne @BayfieldTrain,nocode,116,today s a monochrome dream is out stories via
2296,@NationalGallery Thank you for the information - it's a very beautiful painting 🎨,happy,81,thank you for the information it s a very beautiful painting
2297,#DefiningBeauty wonderful exhibition     * * * *     5 stars    Thank You @britishmuseum   :)  X http://t.co/R7wC7jnKcJ,happy,119,definingbeauty wonderful exhibition stars thank you x
2298,"@britishmuseum Nice info - it is election night in Denmark, so it was difficult keeping the concentration - but it looked interesting.",happy,134,nice info it is election night in denmark so it was difficult keeping the concentration but it looked interesting
2299,@NationalGallery I bought this copy from your museum last summer. Love it! #beauty #artlovers,happy,93,i bought this copy from your museum last summer love it beauty artlovers
2300,@TheLancet @britishmuseum,nocode,25,
2301,@NationalGallery The second GENOCIDE against #biafra as promised by #buhari has begun 3 days of unreported aerial bombardment in #Biafraland,not-relevant,140,the second genocide against biafra as promised by buhari has begun days of unreported aerial bombardment in biafraland
2302,The 'Take One Picture' project gives children across the UK an opportunity to present their work @NationalGallery http://t.co/juGR6aBdWH PD,nocode,139,the take one picture project gives children across the uk an opportunity to present their work pd
2303,Images of #Cambridge May 2015. 3. In the @FitzMuseum_UK.  https://t.co/9YTkdB6mA6,nocode,81,images of cambridge may in the
2304,This Sat #CastleHill15 is packed with free events indoors &amp; out for all ages - plus last chance to see @kettlesyard http://t.co/5kKPcjR7EY,nocode,142,this sat castlehill is packed with free events indoors out for all ages plus last chance to see
