,tweet,emotion,pre_clean_len,clean_text
827,"@britishmuseum Состояние - фантастика, 14-й век !!!",not-relevant,51,
828,QT“@britishmuseum: New on the blog: Richard Parkinson discusses sexual identity #Pride2015 http://t.co/yJrbgstgeB http://t.co/nxi8KZc9tY”,nocode,137,qt new on the blog richard parkinson discusses sexual identity pride
829,"Now for the keynote of the Piero della Francesca conference, by James R. Banker @NationalGallery @CourtauldStudy",nocode,112,now for the keynote of the piero della francesca conference by james r banker
830,It's a great day to #AskTheGallery with both @NationalGallery &amp; @Tate opening their Twitter doors for live questions&gt; http://t.co/tYH5tk8k4x,happy,147,it s a great day to askthegallery with both opening their twitter doors for live questions
831,@DorothyJonesDJ @Gilleeece @Arch_Archive If open &amp; I was in London I would have a nose at http://t.co/PlXdJbfnR1 or always  @britishmuseum,nocode,142,if open i was in london i would have a nose at or always
832,@NationalGallery @CMorosiere real sisters,not-relevant,41,real sisters
833,@SassyClyde We won't stop til @britishmuseum dumps #BP. Fill in a feedback form when you're there &amp; watch this space: http://t.co/o2JlUnGi1y,angry,144,we won t stop til dumps bp fill in a feedback form when you re there watch this space
834,@CamUnivMuseums hurry up and email us your contact number &amp; age for a chat! Time is running out...! E: claire.gellard@shiver.tv! Pls RT!,not-relevant,140,hurry up and email us your contact number age for a chat time is running out e claire gellard tv pls rt
835,@britishmuseum Here #Buddha cutting his hair in renunciation #Gandhara @AshmoleanMuseum http://t.co/5DJCGvk9Mw,nocode,110,here buddha cutting his hair in renunciation gandhara
836,All I can say is WOW - @britishmuseum: Your groundbreaking #8mummies exhibition is fantastic http://t.co/zlty9A4srL,happy,115,all i can say is wow your groundbreaking mummies exhibition is fantastic
837,"Save the date for Artist Talk: Svend Bayer @PlymouthMuseum http://t.co/0GkwYNNgm4 Tues 14 July, 1.10pm",nocode,102,save the date for artist talk svend bayer tues july pm
838,Really enjoyed the #GlennLigon talk @tateliverpool earlier today. His exhibition is truly stimulating!,happy,102,really enjoyed the glennligon talk earlier today his exhibition is truly stimulating
839,Currently @RAMMuseum to discuss #DefeatingDepression with @UofE_Research. Should be interesting.,nocode,96,currently to discuss defeatingdepression with should be interesting
840,@VictoriaRance @kettlesyard @V_and_A these are so beautiful! #GaudierBrzeska,happy,76,these are so beautiful gaudierbrzeska
841,A great @BritishMuseum exhibit is the Lewis Chessmen.Terrific artistry - want to pick up a replica &amp; learn the game! http://t.co/cYjsDCMB1T,happy,143,a great exhibit is the lewis chessmen terrific artistry want to pick up a replica learn the game
842,@britishmuseum   Statue of Poseidon - National Museum Athens,nocode,60,statue of poseidon national museum athens
843,@stockleyacademy students are a joy to be spending a day with @NationalGallery #stockleyart http://t.co/q7IKWrQh6q,happy,114,students are a joy to be spending a day with stockleyart
844,@britishmuseum Is he holding an orange? Someone had better watch out!,surprise,69,is he holding an orange someone had better watch out
845,Get ready for @FL_FLAMIN the Artists Present w/ Beatrice Gibson+ Sarah Turner @_TheWhitechapel http://t.co/HgWldChrCF http://t.co/fSEXRX6pla,nocode,140,get ready for the artists present w beatrice gibson sarah turner
846,Supercool @britishmuseum !! You seriously rock :D,happy,49,supercool you seriously rock d
847,Frames in Focus: Sansovino Frames ... and so much more at the National Gallery #London  @NationalGallery,nocode,104,frames in focus sansovino frames and so much more at the national gallery london
848,"The Emperor #Napoleon in His Study at the Tuileries, (1812), Painted by #Jacques_Louis_David,@NationalGallery of #Art http://t.co/g3aKAnanrS",nocode,140,the emperor napoleon in his study at the tuileries painted by jacques louis david of art
849,@LondonArtCritic's Top 5 Art Shows to 2C in London this week http://t.co/L8MqhHE3nw @LaceyContemp @britishmuseum http://t.co/vlshGgaDou,nocode,135,s top art shows to c in london this week
850,It would have been great to see that material approached using queer theory. @foxvertebrae @britishmuseum,sad,105,it would have been great to see that material approached using queer theory
851,Je ne savais pas qu’il existait une version précédente à celle  @CourtauldStudy et surtout si différente. @NationalGallery @paulperr1 #Manet,nocode,140,je ne savais pas qu il existait une version pr c dente celle et surtout si diff rente manet
852,"Blind Spots, #Pollock black paintings @tateliverpool sounds fascinating, hope I can make the journey north @thetimes http://t.co/V2Y5lPiq2p",happy,139,blind spots pollock black paintings sounds fascinating hope i can make the journey north
853,Practising Artist required to run workshops @PlymouthMuseum http://t.co/WKfkJusLWX Quote required. Deadline: Fri 26 June #artopps,nocode,129,practising artist required to run workshops quote required deadline fri june artopps
854,From The Tomb Of #Nebamun — 1350 BC | #Egyptology #Archaeology #AncientEgypt @britishmuseum http://t.co/moqNQANDZb,nocode,114,from the tomb of nebamun bc egyptology archaeology ancientegypt
855,"@britishmuseum UNESCO  VENETO -THE OPERA collection, per cambiare la storia del Mondo, http://t.co/NsOuQRnFYV",nocode,109,unesco veneto the opera collection per cambiare la storia del mondo
856,@psframes @NationalGallery a much welcomed change.,happy,50,a much welcomed change
857,.@_TheWhitechapel's triennial London Open celebrates creativity across the capital 15 July http://t.co/zkGhAvEBrA http://t.co/A6Ep3JRsLb,nocode,136,s triennial london open celebrates creativity across the capital july
858,@NationalGallery #AskTheGallery Why do you appear to support privatisation? Why don't you value your staff more and support them?,angry,129,askthegallery why do you appear to support privatisation why don t you value your staff more and support them
859,#QueenVictoria's Jubilee Souvenir Badge @britishmuseum http://t.co/52QRZx0QXM,nocode,77,queenvictoria s jubilee souvenir badge
860,The Ratzingeriana is out! http://t.co/MWZJMC4rcF Stories via @LB2S @FitzMuseum_UK,happy,81,the ratzingeriana is out stories via
861,@ICIABath FABulous :-),happy,22,fabulous
862,Thanks @EmmaHiggCN for lovely review! @kettlesyard  https://t.co/3rMImVpqHJ,happy,75,thanks for lovely review
863,"@NationalGallery in Italian ""Still Life"" is ""Natura  Morta""= ""Dead Nature,""while they are more alive than ever....",nocode,114,in italian still life is natura morta dead nature while they are more alive than ever
864,@liveatlica collection in excellent company @LeedsArtGallery - thanks to all involved. @Tate_StIves @newlynexchange http://t.co/fQ34sgf0v6,happy,138,collection in excellent company thanks to all involved
865,@CUBGEducation @MAACambridge ooh sounds good!,happy,45,ooh sounds good
866,"@NationalGallery The 2rd GENOCIDE against #Biafrans as promised by #Buhari has begun,3days of unreported aerial Bombardment in #Biafraland",not-relevant,138,the rd genocide against biafrans as promised by buhari has begun days of unreported aerial bombardment in biafraland
867,Rosalba Carriera's Portrait has also retained its original Venetian 18th century frame @NationalGallery http://t.co/ZqyC4HLsFV,nocode,126,rosalba carriera s portrait has also retained its original venetian th century frame
868,#musicalinstruments in art. Johannes Vermeer 1632-1675 A Lady seated at a Virginal @NationalGallery #genre #oil http://t.co/M7l6pfS56y,nocode,134,musicalinstruments in art johannes vermeer a lady seated at a virginal genre oil
869,"Discount_Rayban_19,Online_31 http://t.co/qT8e7T4nJG http://t.co/bc64zXbXMR @tateliverpool @tatiadrytwitt @tatianacosta10 @tatianahere",nocode,133,discount rayban online
870,Thresholds poet @CamUnivMuseums @classarch Sean Borodale's Bee Journal R3 listen again : http://t.co/TIgagP3M9A”,nocode,112,thresholds poet sean borodale s bee journal r listen again
871,Tomorrow at #cheltlitfest @CraigClunas talks about @britishmuseum exhibition on Ming dynasty http://t.co/6jU9D1nYv3 http://t.co/LqefFzebQr,nocode,138,tomorrow at cheltlitfest talks about exhibition on ming dynasty
872,"@redhead262 @Tate_StIves @Tate In the garden, yes!  But not in the gallery. How will I restrain myself from patting #Tides 1946 ?",happy,129,in the garden yes but not in the gallery how will i restrain myself from patting tides
873,@britishmuseum w/ @bquentin3 &amp; zada_beda feeling like 21st Century is underperforming &amp; not sure… https://t.co/Q0Dmt8MPZU,sad,129,w zada beda feeling like st century is underperforming not sure
874,Link http://t.co/6E5WzwVikN por @britishmuseum es el tuit más popular en mis 'news feed' de hoy,nocode,95,link por es el tuit m s popular en mis news feed de hoy
875,@MooseAllain I look forward to congratulating you in person :-) @roshvarosha @LisaLooly @newmanmpaul @DrawntoDevon @ThelmaHulbert,happy,129,i look forward to congratulating you in person
876,"@nationalgallery Nicholas Penny, how does it feel to get a knighthood?!",nocode,71,nicholas penny how does it feel to get a knighthood
877,@NationalGallery One of my favourite paintings!,happy,47,one of my favourite paintings
878,#painting #inprogress #GerardDavid @nationalgallery #oil so much Thursday fun! https://t.co/4YTblNpLaz,happy,102,painting inprogress gerarddavid oil so much thursday fun
879,"@johnmbrampton @CambridgeNewsUK @kettlesyard Thank you, John!",happy,61,thank you john
880,"@Needforcaffeine @lisaj2108 @FitzMuseum_UK Had a personal tour, no less... ;)",happy,77,had a personal tour no less
881,Thanks for an inspiring day + warm welcome @FitzMuseumEduca @carreno_k @RachelSinfield @CamUnivMuseums,happy,102,thanks for an inspiring day warm welcome
882,#FF follow Friday! @britishmuseum @Hellena7007 @CreateHistorian @indianamonts @DrVictoria01,nocode,91,ff follow friday
883,"A ‘sparkling show’ of Turner, Singer Sargent, Cézanne watercolours @FitzMuseum_UK, Cambridge http://t.co/VJnko74IO5 http://t.co/WLJSb0s1qe",happy,138,a sparkling show of turner singer sargent c zanne watercolours cambridge
884,@NationalGallery When will you reinstate Candy Udwin? #AskTheGallery,nocode,68,when will you reinstate candy udwin askthegallery
885,@britishmuseum @sovonstar We should share this with DAN BAIRD ~ GOTHIC ARTIST this drawing is by artist SALVATOR ROSA born 1615 ~ ETCHING!,happy,138,we should share this with dan baird gothic artist this drawing is by artist salvator rosa born etching
886,@britishmuseum @thehistoryguy NOTHING  CHANGED % NON È CAMBIATO NULLA % НИЧЕГО НЕ ИЗМЕНИЛОСЬ (((((( NO HA CAMBIADO NADA,nocode,119,nothing changed non cambiato nulla no ha cambiado nada
887,@NationalGallery,not-relevant,16,
888,Relics and experiments at Barbara Hepworth's studio in St Ives @Tate_StIves #artiststudio # cornwall #scupture http://t.co/3aJLxm05Zg,nocode,133,relics and experiments at barbara hepworth s studio in st ives artiststudio cornwall scupture
889,@NationalGallery What a beauty! #Baroque,happy,40,what a beauty baroque
890,"""@corneliagracchi: @PSmirn @britishmuseum Approximately 25% less than he/she once ""urned"""" Precisely!",nocode,101,approximately less than he she once urned precisely
891,ATTN: Museum of stolen property. Hand back our culture. @britishmuseum http://t.co/KNfY53G7Gt #SOSBLAKAUSTRALIA #NOconsent,angry,122,attn museum of stolen property hand back our culture sosblakaustralia noconsent
892,Strikers at @Shell -sponsored @NationalGallery protest against #privatisation #kayaktivists #ShellNo @billmckibben http://t.co/UnGD3naDSn,angry,137,strikers at sponsored protest against privatisation kayaktivists shellno
893,"@ColinGoffin @imagineinquiry Hi, from the @britishmuseum queue. http://t.co/xkZAjuCXlL",nocode,86,hi from the queue
894,"@adelegeras @FitzMuseum_UK never heard of it , next time i'm in uk will happy to visit:)",happy,88,never heard of it next time i m in uk will happy to visit
895,"Sunset in the Auvergne, by Théodore Rousseau.  Thought to be completed 1844  (@NationalGallery) http://t.co/q5C4d0xWfF",nocode,118,sunset in the auvergne by th odore rousseau thought to be completed
896,@Tate_StIves great to hear her talk about the event. I definitely left with a 'feeling of madness' #materialhistories,happy,117,great to hear her talk about the event i definitely left with a feeling of madness materialhistories
897,"So pleased our fav artist Richard Long wins @_TheWhitechapel award, incredible body of work in 'Time and Space' http://t.co/8uO9ecyeGK",happy,134,so pleased our fav artist richard long wins award incredible body of work in time and space
898,The chorus of @MedeaNX @Britishmuseum http://t.co/rFdRA7lHOc,nocode,60,the chorus of
899,Great afternoon at @britishmuseum #DefiningBeauty exhibition with @RiaSarantaridou and @brownie72 :),happy,100,great afternoon at definingbeauty exhibition with and
900,Rock art can be helpful in learning about different ways in which camels were used in 1st mill CE http://t.co/yJ7uqCDr6V @britishmuseum,nocode,135,rock art can be helpful in learning about different ways in which camels were used in st mill ce
901,"@artfund @NationalGallery @HelenHillyard Hi, is it possible to make it clear that the Baroque Galleries open to public Fri June 19? Thanks!",nocode,139,hi is it possible to make it clear that the baroque galleries open to public fri june thanks
902,"@britishmuseum @BBCTwo Great news, I've been taping the series and listening to BBC4 as well - fascinating and informative, many thanks!",happy,136,great news i ve been taping the series and listening to bbc as well fascinating and informative many thanks
903,@NationalGallery 😢 http://t.co/wXjHe34Dkp,nocode,41,
904,"“@britishmuseum: Born #onthisday in 1898: artist M C Escher, representation of Tower of Babel http://t.co/YhiLc4svUw http://t.co/8sfOWxmL1q”",nocode,140,born onthisday in artist m c escher representation of tower of babel
905,Volunteers needed for ARTIST ROOMS: Gerhard Richter @PlymouthMuseum http://t.co/8leTEA8rUs Deadline: Thurs 3 Sept #artopps,not-relevant,122,volunteers needed for artist rooms gerhard richter deadline thurs sept artopps
906,@britishmuseum So much teeth problems un ancient Egypt!!! 😁,surprise,59,so much teeth problems un ancient egypt
907,"@Kateprintmaker @ComptonVerney This is a real treat, full of inspiration from the @britishmuseum Curious Beasts http://t.co/Gbw1snPRLW",happy,134,this is a real treat full of inspiration from the curious beasts
908,Thrilled to listen to erudite Neil MacGregor from @britishmuseum talking about Germany @CVHISTORYFEST http://t.co/zalas08jDb,happy,124,thrilled to listen to erudite neil macgregor from talking about germany
909,@gilescolborne speaking at the @britishmuseum is pretty exciting / daunting... Still trying to decide whether to bring my Mummy or not! 😉,happy|surprise,137,speaking at the is pretty exciting daunting still trying to decide whether to bring my mummy or not
910,@britishmuseum by Nicholas Hilliard?,nocode,36,by nicholas hilliard
911,What lies beneath: drapery and the suggested form @britishmuseum  http://t.co/GCUs1yOBHP,nocode,88,what lies beneath drapery and the suggested form
912,Director @NationalGallery Nicholas Penny is hosting twitter Q&amp;A on Tue 16th June 10.30am-11.30am #AskTheGallery info: http://t.co/IyiGgvW22C,not-relevant,144,director nicholas penny is hosting twitter q a on tue th june am am askthegallery info
913,"@artinsociety Thanks, good article @NationalGallery @NeilKC41 #BertheMorisot's dau #JulieManet's diary re her family http://t.co/tlj0vPPM35",happy,139,thanks good article berthemorisot s dau juliemanet s diary re her family
914,Also enjoyed James Richards speaker-bombarding Francis Bacon with soundscape @_TheWhitechapel http://t.co/83UWPwtaiR,happy,116,also enjoyed james richards speaker bombarding francis bacon with soundscape
915,From The Tomb Of #Nebamun — 1350 BC | #Egyptology #Archaeology #AncientEgypt @britishmuseum http://t.co/NhMPGK787R,nocode,114,from the tomb of nebamun bc egyptology archaeology ancientegypt
916,@_TheWhitechapel Please follow contemporary conceptual paintings @royalacademy 2005 Visitor artist @ChitraRamnathan http://t.co/aqu0bfvzO2,nocode,138,please follow contemporary conceptual paintings visitor artist
917,Will someone take me to see the mummies at the @britishmuseum please please please??? 🙏🏼,happy,88,will someone take me to see the mummies at the please please please
918,Whale move again http://t.co/qoWiqtA4LP via @camunivmuseums @zoologymuseum @migratorymatt @whale_whispers #raisethewhale,nocode,120,whale move again via raisethewhale
919,Engaging work from @opticalmeg at @RAMMuseum #photography #art #wellcometrust http://t.co/yyuw27UH7v,happy,100,engaging work from at photography art wellcometrust
920,Morning folks! Last week left for 13-18 year olds to win 2 free tix to Defining Beauty at @britishmuseum. Go to our Facebook page for info,nocode,138,morning folks last week left for year olds to win free tix to defining beauty at go to our facebook page for info
921,Being good at hunting pays off. King kisses Tristram as a reward @britishmuseum #pride #Pride2015 #PrideinLondon http://t.co/rvUzN5vnpG,happy,135,being good at hunting pays off king kisses tristram as a reward pride pride prideinlondon
922,A good idea to refresh the perception of the @NationalGallery collection or a modish attempt at trendiness? http://t.co/HHiHr1CXVa,nocode,130,a good idea to refresh the perception of the collection or a modish attempt at trendiness
923,@Tate #markgodfrey speaking to the #cca #rca students at @_TheWhitechapel this morning #christopherwilliams http://t.co/dkBrmSxCP9,nocode,130,markgodfrey speaking to the cca rca students at this morning christopherwilliams
924,The 2 things that most moved Angela Merkel at the @britishmuseum Germany show: Luther's Bible &amp; the model of the Friedrichstrasse station.,nocode,142,the things that most moved angela merkel at the germany show luther s bible the model of the friedrichstrasse station
925,@annietrev @britishmuseum Two Britons held over Auschwitz theft http://t.co/kA4d2igJxo,not-relevant,86,two britons held over auschwitz theft
926,"@NationalGallery This is one of my favourite paintings at the National Gallery, I know where it's hung. Beautiful!",happy,114,this is one of my favourite paintings at the national gallery i know where it s hung beautiful
927,"Today, find us at Castle Hill Open Day 2015 @kettlesyard at the Methodist Church. #CastleHill15   Serving 12-4. http://t.co/pMO3b0vZOY",nocode,134,today find us at castle hill open day at the methodist church castlehill serving
928,@britishmuseum that was a marvelous @periscopeco broadcast on Napoleon just now. Great use of this new service.,happy,111,that was a marvelous broadcast on napoleon just now great use of this new service
929,"These two men in @BritishMuseum from Jebel Sahaba died 13,000 years ago, their bodies riddled with arrows. http://t.co/xJNjmKjB87",nocode,129,these two men in from jebel sahaba died years ago their bodies riddled with arrows
930,@britishmuseum @thehistoryguy at what time?,not-relevant,43,at what time
931,Find out how @TateCollectives @tateliverpool worked with #camhs FRESH with Tate Collective Liverpool | Circuit https://t.co/p9KT6DHP5h,nocode,134,find out how worked with camhs fresh with tate collective liverpool circuit
932,"I'm at @BritishMuseum in London, Greater London http://t.co/eLzYpV0p08",nocode,70,i m at in london greater london
933,@britishmuseum do you think that Napoleon lost because of Russian campain or Waterloo?,nocode,86,do you think that napoleon lost because of russian campain or waterloo
934,@UofE_Research thank you for following me back. Well done for gathering such an interesting panel for #DefeatingDepression @RAMMuseum,happy,133,thank you for following me back well done for gathering such an interesting panel for defeatingdepression
935,The exquisite #Waddesdon Bequest @britishmuseum is absolutely exceptional. Not to be missed. &amp; it's free! #museumhour http://t.co/Et4h7kRLCr,happy,144,the exquisite waddesdon bequest is absolutely exceptional not to be missed it s free museumhour
936,Had a wonderful time @britishmuseum with @JLMcAleer. Thank you for having me! @SOCLtweet http://t.co/MecWvVlR7E,happy,111,had a wonderful time with thank you for having me
937,PLUS:) WILL MAKE RAINS in CALIFORNIA please CLEAN yours STREET  DRAINERS  AVOID FLOODS my HONEY$ HASKELL ART @NationalGallery  THANK YOU RT,not-relevant,139,plus will make rains in california please clean yours street drainers avoid floods my honey haskell art thank you rt
938,@tateliverpool Hi there! We've just created this guide of #Liverpool and mentioned you. http://t.co/erjPmVbNMD,nocode,110,hi there we ve just created this guide of liverpool and mentioned you
939,@NationalGallery #lovely,happy,24,lovely
940,Link http://t.co/OPHb3esWIp por @britishmuseum es el tuit más popular en mis 'news feed' de hoy,not-relevant,95,link por es el tuit m s popular en mis news feed de hoy
941,"Plaga de orientales. (at @BritishMuseum in London, Greater London) https://t.co/MPgrKbBbwq",nocode,90,plaga de orientales at in london greater london
942,The Ligon/Pollock exhibition .@tateliverpool that opened today is one of the best in ages. Glenn  Ligon also seems such a nice guy #pollock,happy,139,the ligon pollock exhibition that opened today is one of the best in ages glenn ligon also seems such a nice guy pollock
943,"Book for Making &amp; Promoting British Art @PlymouthMuseum http://t.co/gZePLgdc95 Tues 23 June, 1.10pm, £2",nocode,107,book for making promoting british art tues june pm
944,@britishmuseum He looks so happy......not.,nocode,42,he looks so happy not
945,@psframes @NationalGallery # I #LOVE The National Gallery!,happy,58,i love the national gallery
946,@NationalGallery brought son to see Stubbs - v disappointed by room closures re strike action- why close the most popular rooms?,sad|angry,128,brought son to see stubbs v disappointed by room closures re strike action why close the most popular rooms
947,The Alchemist by Pieter Bruegel the Elder  #art for #StrangeandNorrell in @britishmuseum http://t.co/WMyG34ieii,nocode,111,the alchemist by pieter bruegel the elder art for strangeandnorrell in
948,@Libby_Brodie @NationalGallery interesting variety,happy,50,interesting variety
949,Delicious Dorset crab with avocado and gazpacho @ the beautiful @NationalGallery with @EventConcept #gailsmithflowers http://t.co/sJOfm6E66y,happy,140,delicious dorset crab with avocado and gazpacho the beautiful with gailsmithflowers
950,@NationalGallery,not-relevant,16,
951,Looking forward to our public engagement event #DefeatDepression  @RAMMuseum @UofE_Research this evening http://t.co/GAG3iJveaC,happy,127,looking forward to our public engagement event defeatdepression this evening
952,@britishmuseum @emussj Greatest car park attendant this country has ever seen.,happy,78,greatest car park attendant this country has ever seen
953,At @RAMMuseum listening to @chrisrwatson Ebb &amp; Flow summer with @Paul4Cowick &amp; Gerald http://t.co/NrW8xmehgc,nocode,116,at listening to ebb flow summer with gerald
954,Early morning viewing of Defining Beauty at @britishmuseum quite the inspiration for the rest of the day. What a complete treat.,happy,128,early morning viewing of defining beauty at quite the inspiration for the rest of the day what a complete treat
955,"“@NationalGallery: placing the trees on a diagonal axis, Rousseau conveys a sense of the wind http://t.co/j0vVeGYJTr"" For you, @whatSFSaid",nocode,138,placing the trees on a diagonal axis rousseau conveys a sense of the wind for you
956,@HistoryGems @britishmuseum something from ancient Egypt ?,nocode,58,something from ancient egypt
957,Enjoying the afternoon at @NationalGallery. #artheals,happy,53,enjoying the afternoon at artheals
958,'I prefer #art to fast cars': fund manager helps British Museum buy Picasso works http://t.co/qhm51iLLL9 @BritishMuseum #Picasso,nocode,128,i prefer art to fast cars fund manager helps british museum buy picasso works picasso
959,@kettlesyard @Countrylifemag look forward to visiting this week. #art #Cambridge,happy,80,look forward to visiting this week art cambridge
960,Frames can be works of art on their own. Visit our free #SansovinoFrames exhibition http:... http://t.co/RaxtWpBXYv via @NationalGallery,happy,136,frames can be works of art on their own visit our free sansovinoframes exhibition http via
961,I'm introducing @britishmuseum Director Neil MacGregor-Germany:Memories of a Nation at #cheltlitfest tomorrow http://t.co/JoyLMUh2Tm Come!,happy,138,i m introducing director neil macgregor germany memories of a nation at cheltlitfest tomorrow come
962,#DefiningBeauty @britishmuseum finally visited the exhibition before it closed next week.. Well worth the trip to London. A brilliant time.,happy,139,definingbeauty finally visited the exhibition before it closed next week well worth the trip to london a brilliant time
963,"I'm at @NationalGallery in London, Greater London https://t.co/yA2BEDdTEf",nocode,73,i m at in london greater london
964,@pwadey @NationalGallery I have turned the exposure up on this painting to enable easier viewing. #TooDark http://t.co/EBXLSSIDIZ,nocode,129,i have turned the exposure up on this painting to enable easier viewing toodark
965,¿Como se ve la serpiente mexica de dos cabezas a colores? En el @britishmuseum nos enseñan http://t.co/GKgbC3Q4aI http://t.co/ebRUk4jent,nocode,136,como se ve la serpiente mexica de dos cabezas a colores en el nos ense an
