,tweet,emotion,pre_clean_len,clean_text
1509,@NationalGallery Is there a particular piece that you are striving to acquire?,nocode,78,is there a particular piece that you are striving to acquire
1510,"Chris Wingfield @MAACambridge reads John P.McCarthy's paper ""Negotiating African Identity:Cemeteries of the First African Baptist Church,PA""",nocode,140,chris wingfield reads john p mccarthy s paper negotiating african identity cemeteries of the first african baptist church pa
1511,@psframes I finally saw the frames! @NationalGallery #sansovino Beautiful.,happy,74,i finally saw the frames sansovino beautiful
1512,See Christopher Williams - The Production Line of Happiness - via @_TheWhitechapel http://t.co/pvFmI1NJKm http://t.co/cgmhkfXrtL,nocode,128,see christopher williams the production line of happiness via
1513,See Christopher Williams - The Production Line of Happiness - via @_TheWhitechapel http://t.co/q4n0seYkBL http://t.co/bQ1OaE1Pos,nocode,128,see christopher williams the production line of happiness via
1514,A few of my loves from today. Thank you @NationalGallery for sharing art with the public. It's a #beautifulthing. http://t.co/z8iba7LX1g,happy,136,a few of my loves from today thank you for sharing art with the public it s a beautifulthing
1515,"#NG365 Jacob van Ruisdael's ""A Panoramic View of Amsterdam"" @NationalGallery #art @JohnConstableRA http://t.co/bKcJRJEZnv",nocode,121,ng jacob van ruisdael s a panoramic view of amsterdam art
1516,Sculpture from the Parthenon @britishmuseum w/ @kboyceq &amp; zada_beda Wow! https://t.co/YNU2CxV4VJ,happy,100,sculpture from the parthenon w zada beda wow
1517,A big shout out &amp; huge congratulations to @HelenHillyard for the newly displayed Baroque Galleries @BM_AG @NationalGallery @artfund #launch,happy,143,a big shout out huge congratulations to for the newly displayed baroque galleries launch
1518,Probably a Julio Claudian prince on horseback  in the Great Court of the  @britishmuseum #RomanStatue #Archaeology http://t.co/9DwpwQFQQp,nocode,137,probably a julio claudian prince on horseback in the great court of the romanstatue archaeology
1519,. @GavinGrindon @NationalGallery have we received an answer yet?  #AskTheGallery,not-relevant,80,have we received an answer yet askthegallery
1520,Discover The Arts with Social Media: NOHO Co-Founder Rod McIntosh on NOHO Origins* https://t.co/tJmlzSRVvv @NationalGallery #London #Art,nocode,136,discover the arts with social media noho co founder rod mcintosh on noho origins london art
1521,"@NationalGallery The second GENOCIDE against #Biafrans as promised by #Buhari has begun, 3 days of unreported aerial Bombardment in #Biafra",not-relevant,139,the second genocide against biafrans as promised by buhari has begun days of unreported aerial bombardment in biafra
1522,@Tate_StIves plus rocking an amazing dress!,happy,43,plus rocking an amazing dress
1523,"I'm at @BritishMuseum in London, Greater London https://t.co/9Cg7IGIDWh",nocode,71,i m at in london greater london
1524,"#NG365 Vermeer's ""A Young Woman Seated at a Virginal"" c.1670 @NationalGallery #art #twitart http://t.co/mScSqghyPZ",nocode,114,ng vermeer s a young woman seated at a virginal c art twitart
1525,During your tenure @NationalGallery really improved environmental performance &amp; achieved Carbon Trust Standard. What's next? #AskTheGallery,happy,143,during your tenure really improved environmental performance achieved carbon trust standard what s next askthegallery
1526,"@WeesyT no problem, I am enjoying the amazing @britishmuseum at least for another 10 minutes :)",happy,95,no problem i am enjoying the amazing at least for another minutes
1527,"Save the date for Artist Talk: Svend Bayer @PlymouthMuseum http://t.co/0GkwYNNgm4 Tues 14 July, 1.10pm",nocode,102,save the date for artist talk svend bayer tues july pm
1528,I've reviewed the new exhibition @tateliverpool.  Sort of: http://t.co/aBh967rncP,nocode,81,i ve reviewed the new exhibition sort of
1529,Had to snap @britishmuseum You ridiculous pretty. That caged glass ceiling thing you got going on def… https://t.co/ixVZzpkhcs,happy,126,had to snap you ridiculous pretty that caged glass ceiling thing you got going on def
1530,.@Corbyn4Leader can you attend adjournment debate tomorrow #noprivatisation @NationalGallery #reinstatecandy @NGNotForSale @PCSCultureGroup,nocode,139,can you attend adjournment debate tomorrow noprivatisation reinstatecandy
1531,Re-housing the Inuit art was a big hit with our @CamUnivMuseums work experience students https://t.co/vUw9npPBfS,happy,112,re housing the inuit art was a big hit with our work experience students
1532,@britishmuseum Will u do some posts of #breastfeeding in anyway for Nat'l #celebratebreastfeeding week 20-28th June? https://t.co/p3yZ0Y0g5i,nocode,140,will u do some posts of breastfeeding in anyway for nat l celebratebreastfeeding week th june
1533,".@FitzMuseum_UK is the most brilliant museum! And Friends of the Museum are v. nice too...thanks, Sarah and Jane!",happy,113,is the most brilliant museum and friends of the museum are v nice too thanks sarah and jane
1534,Handstands in a Gallery - hear more @CircuitPHF @tateliverpool Walton Youth Project Partnership – Part 1 | Circuit https://t.co/hVACpuU4EN,nocode,138,handstands in a gallery hear more walton youth project partnership part circuit
1535,Reviewed Leonora Carrington's visit to @tateliverpool for @TheSkinnyNW here: http://t.co/XeNhMwuJFo #mexicanart #surrealism #artreview,nocode,134,reviewed leonora carrington s visit to for here mexicanart surrealism artreview
1536,@appendixjournal @MartinPribble @FitzMuseum_UK So the Swiss Army knife is really a Roman army knife? I'm going to engrave SPQR on mine.,surprise,135,so the swiss army knife is really a roman army knife i m going to engrave spqr on mine
1537,Off on Friday to look after my youngest. Planning a trip to see Jackson Pollock's Blind Spots exhibition @tateliverpool #culturedtoddler,nocode,136,off on friday to look after my youngest planning a trip to see jackson pollock s blind spots exhibition culturedtoddler
1538,I had sneak preview of other delights delegates to @SWFed conference can sample @devonportguildhall @PlymouthMuseum http://t.co/MipVuwpNzP,happy,138,i had sneak preview of other delights delegates to conference can sample
1539,@britishmuseum Ruin for Spain.,not-relevant,30,ruin for spain
1540,@NationalGallery Make a great BBC4 TV documentary.,happy,50,make a great bbc tv documentary
1541,#CAPP_eu meets in #Helsinki with @CreateIreland @tateliverpool @ludwigmuseum @thisisliveart @TheHeartofGlass @KunsthalleOS @agoracollective,nocode,139,capp eu meets in helsinki with
1542,Went to this lovely show @FitzMuseum_uk last week. Now the late-running catalogue has made an appearance. http://t.co/5MukWUBdWJ,happy,128,went to this lovely show last week now the late running catalogue has made an appearance
1543,@CarolineLawrenc @britishmuseum I've never bothered to look up the Latin. Thanks!,nocode,81,i ve never bothered to look up the latin thanks
1544,@kettlesyard We are happy to! Looks like a good event :),happy,56,we are happy to looks like a good event
1545,@NationalGallery This is one of my favourites; have a copy from the NG framed &amp; hanging right next to me.,happy,109,this is one of my favourites have a copy from the ng framed hanging right next to me
1546,#EthelMaude's 'Exquisite Corpse' at @_TheWhitechapel in London in Luminous Latitude: New Artists' Films from Scotland http://t.co/f5seZK3rG4,nocode,140,ethelmaude s exquisite corpse at in london in luminous latitude new artists films from scotland
1547,A taster of the upcoming Seminar for Arabian Studies w @theBFSA @BritishMuseum next month! http://t.co/jodXRPHrEn,nocode,113,a taster of the upcoming seminar for arabian studies w next month
1548,Check out Corin Sworn's exhibition for @maxmara Art Prize for Women @_TheWhitechapel http://t.co/5GEEw9ysQu http://t.co/2S2O4D8roM,nocode,130,check out corin sworn s exhibition for art prize for women
1549,"Topic suggested by Katy Ball after finding ""Professor Manakata's British Museum Adventure"" (Yukinobo), after Manga exhibition @britishmuseum",nocode,140,topic suggested by katy ball after finding professor manakata s british museum adventure yukinobo after manga exhibition
1550,@britishmuseum Is anything known about Dumouriez in light of Waterloo?They said he was with #Wellington #Waterloo200 http://t.co/1bQqmRGSYx,nocode,139,is anything known about dumouriez in light of waterloo they said he was with wellington waterloo
1551,"@britishmuseum Will Andrew Roberts be doing anything on Napoleon's exile and death in St. Helena, or just Waterloo? #Waterloo200",nocode,128,will andrew roberts be doing anything on napoleon s exile and death in st helena or just waterloo waterloo
1552,"Detail, bottom left, Claude Monet, Water-lilies, after 1916 @NationalGallery #Monet http://t.co/OllMf7L42X",nocode,106,detail bottom left claude monet water lilies after monet
1553,@WaddesdonManor on the Tube thanks to @britishmuseum. Completely thrilling!! http://t.co/QESBnOpe1s,happy,99,on the tube thanks to completely thrilling
1554,@Asamsakti   Piero do Cosimo A Satyr Mourning Over A Nymph ca 1495 @NationalGallery  London,nocode,91,piero do cosimo a satyr mourning over a nymph ca london
1555,I want to read about  LondonArtWeek @NationalGallery @LondonArtWeek,nocode,67,i want to read about londonartweek
1556,Makeway for Noddy! Enjoying new #EnidBlyton exhibition  @PlymouthMuseum #SevenStories http://t.co/lojsVz1wCz,happy,108,makeway for noddy enjoying new enidblyton exhibition sevenstories
1557,Setting up at St Peters Cambridge for #CastleHill open day. Looks to be a great day! @kettlesyard @VisitCambs http://t.co/vUcWmdAbna,happy,132,setting up at st peters cambridge for castlehill open day looks to be a great day
1558,James Richards composes a sonic score for a Francis Bacon painting @_TheWhitechapel part of VAC Collection displays http://t.co/q3CFSJuXeQ,nocode,138,james richards composes a sonic score for a francis bacon painting part of vac collection displays
1559,@britishmuseum @LoveCamden @britishlibrary I remember watching them build that from my office in the tower next door.. now a hotel,nocode,130,i remember watching them build that from my office in the tower next door now a hotel
1560,@ThelmaHulbert @LisaLooly @DrawntoDevon @MooseAllain @DavidSmithArt @roshvarosha I knew that working only in graphite would one day pay off,happy,139,i knew that working only in graphite would one day pay off
1561,@NationalGallery,not-relevant,16,
1562,#PieroDellaFrancesca fascine tous les visiteurs de la @NationalGallery http://t.co/A7JtcL4N73,happy,93,pierodellafrancesca fascine tous les visiteurs de la
1563,"Today's fun, taking a #museumselfie whilst @maustinpics photographed me in @RAMMuseum's #socialfabric exhibition! http://t.co/7dE7Uoadqp",happy,136,today s fun taking a museumselfie whilst photographed me in s socialfabric exhibition
1564,From The Tomb Of #Nebamun — 1350 BC | #Egyptology #Archaeology #AncientEgypt @britishmuseum http://t.co/iJNaUvqhY7,nocode,114,from the tomb of nebamun bc egyptology archaeology ancientegypt
1565,"Excited to have a FLASH Residency at @Studio44AD this Summer, starting next month! @FringeArtsBath @CreativeBath @bathnes @ICIABath",happy,131,excited to have a flash residency at this summer starting next month
1566,See all the photos from Wednesday's #DefeatingDepression event at @RAMMuseum: http://t.co/eDerP8RflP,nocode,100,see all the photos from wednesday s defeatingdepression event at
1567,Lo viste? El tuit más popular de hoy entre las personas que sigo http://t.co/IV21zLi8Zt por @britishmuseum,nocode,106,lo viste el tuit m s popular de hoy entre las personas que sigo por
1568,Friday night @FitzMuseum_UK listening to Tim Knox speaking about country house collections #objects2015 http://t.co/aYh36Hkx3i,nocode,126,friday night listening to tim knox speaking about country house collections objects
1569,"Had the most amazing morning at the #emptyNG event, such a privilege! Big thanks to @londonlivindoll and the @NationalGallery for having us😍",happy,140,had the most amazing morning at the emptyng event such a privilege big thanks to and the for having us
1570,An auspicious jewel: a symbolic bubble for a C19th Japanese painting of the Seven Gods of Good Fortune @britishmuseum http://t.co/EwBA64UN2X,nocode,140,an auspicious jewel a symbolic bubble for a c th japanese painting of the seven gods of good fortune
1571,"#ShoutAbout #AskTheGallery Have you got any plans for #London focussed exhibitions? i.e ""London through the ages"" @NationalGallery",nocode,130,shoutabout askthegallery have you got any plans for london focussed exhibitions i e london through the ages
1572,"'Life Lessons from the Old Masters', on Death. July 4 @NationalGallery http://t.co/cCLsDmQ4zI  #DeathArt with Jon Underwood &amp; @ArtandPerfume",nocode,144,life lessons from the old masters on death july deathart with jon underwood
1573,.@Tate_StIves curated a superb show of paintings by Terry Frost now on @LeedsArtGallery http://t.co/aVpZGl2MMq #terryfrost #leeds #painting,happy,139,curated a superb show of paintings by terry frost now on terryfrost leeds painting
1574,The new Waddesdon Collection room at @britishmuseum is quite something. I haven't seen so much bling since Vienna!,happy|surprise,114,the new waddesdon collection room at is quite something i haven t seen so much bling since vienna
1575,"@tateliverpool I'm trying to book the members curator talk or guided tour for pollock, but the links don't work. Are they sold out?",sad,131,i m trying to book the members curator talk or guided tour for pollock but the links don t work are they sold out
1576,A new look at ancient Egyptian textiles http://t.co/UJQ8z84c2E via @britishmuseum,happy,81,a new look at ancient egyptian textiles via
1577,Come &amp; hear songs from the @smithsonian Folkways archive played by @britishmuseum’s @GlennCumiskey &amp; band. July 7. https://t.co/Pc6XQZvJMh,nocode,146,come hear songs from the folkways archive played by s band july
1578,"Looking forward to a workshop @britishmuseum on working with older ppl, exploring diversity &amp; sustainable partnerships #agefriendlymuseums 😊",happy,144,looking forward to a workshop on working with older ppl exploring diversity sustainable partnerships agefriendlymuseums
1579,Vast Database of African Rock Art Goes Online http://t.co/eqhIWYfiZ8 @britishmuseum,nocode,83,vast database of african rock art goes online
1580,"Nicholas Penny, outgoing director @NationalGallery, is knighted ""for services to the arts."" http://t.co/h13pG6y7y5",nocode,114,nicholas penny outgoing director is knighted for services to the arts
1581,Day 56:  @NationalGallery of Australia gardens in Canberra. #100daysofAustralia #apicaday http://t.co/WppSpikB8I,nocode,112,day of australia gardens in canberra daysofaustralia apicaday
1582,"Fallen Emperor: Napoleon in #Plymouth Sound in 1815, exhib @PlymouthMuseum until 26th Sept #art #waterloo200 http://t.co/j3EBiKGYZe",nocode,131,fallen emperor napoleon in plymouth sound in exhib until th sept art waterloo
1583,@OptimoPrincipi @britishmuseum that one looks so real,surprise,53,that one looks so real
1584,Coffee time: I'm thinking of you @britishmuseum Pen is a pen is a pen... Like a rose http://t.co/95NVs9wx0v,nocode,107,coffee time i m thinking of you pen is a pen is a pen like a rose
1585,James Richards accompanying Francis bacon goosebumps ❤️ @_TheWhitechapel,nocode,72,james richards accompanying francis bacon goosebumps
1586,@britishmuseum on INSTA. Today is the longest day in the northern hemisphere – here’s the #SummerSolstice at Stoneh… http://t.co/Mh3IFM2NkB,nocode,139,on insta today is the longest day in the northern hemisphere here s the summersolstice at stoneh
1587,We're open until 9pm tonight. Start your weekend with us: http://t.co/j5IFZpwXdV http://t... http://t.co/4GDmFSPrRR via @NationalGallery,nocode,136,we re open until pm tonight start your weekend with us via
1588,Make an LED circuit brooch at the British Museum this weekend http://t.co/JzHniW3ttP @britishmuseum,nocode,99,make an led circuit brooch at the british museum this weekend
1589,"Dear @NationalGallery, #divestment is on the up. Will u join in &amp; stop accepting $ from the fossil fuel industry? #AskTheGallery",nocode,132,dear divestment is on the up will u join in stop accepting from the fossil fuel industry askthegallery
1590,Short video clip of Termas: Underwater Throne performance @Tate_StIves last weekend https://t.co/OmjF1Bd10f,nocode,107,short video clip of termas underwater throne performance last weekend
1591,Little bit excited about this tomorrow. It's a BIG weekend for @kettlesyard and friends.  #CastleHill15  https://t.co/WwdLeSc4RN,happy,128,little bit excited about this tomorrow it s a big weekend for and friends castlehill
1592,@pwadey @NationalGallery I think for web viewing it is hard to get the right balance. They cannot help the Forgers and Copyists too much!,nocode,137,i think for web viewing it is hard to get the right balance they cannot help the forgers and copyists too much
1593,Today @LouieJamesKeen and I are off to look at some mummies at @britishmuseum #happysuday,happy,89,today and i are off to look at some mummies at happysuday
1594,@periscopeco @britishmuseum ok 10 mins...,nocode,41,ok mins
1595,Enjoyed the excellent artist talk by Glen Ligon. @tateliverpool,happy,63,enjoyed the excellent artist talk by glen ligon
1596,"@NationalGallery The 2nd GENOCIDE against #Biafrans as promised by #Buhari has begun,3days of unreported aerial Bombardment in #Biafraland",not-relevant,138,the nd genocide against biafrans as promised by buhari has begun days of unreported aerial bombardment in biafraland
1597,Please have a look and comment on our Lichtenstein Art! @ngadc @Tate @NationalGallery @MuseumModernArt  http://t.co/TBxqUoT9EZ,nocode,126,please have a look and comment on our lichtenstein art
1598,"@britishmuseum @basilissa11 Hi, Israel!",nocode,39,hi israel
1599,@britishmuseum Did Napoleon really say Britain was a nation of shopkeepers?,surprise,75,did napoleon really say britain was a nation of shopkeepers
1600,@tarbosaur @profjoecain @britishmuseum yes mermaid wonderfully scary  for the kids - but now seems to have gone last time we looked,sad,131,yes mermaid wonderfully scary for the kids but now seems to have gone last time we looked
1601,We popped to @FitzMuseum_UK at lunch today to see this lovely exhibition! Highly recommended! #MOOi #cambridge https://t.co/B7XttaxXx3,happy,134,we popped to at lunch today to see this lovely exhibition highly recommended mooi cambridge
1602,Unmissable! @TheCassArt Summer Show opens tonight. En route via @_TheWhitechapel http://t.co/jiu97u6zce http://t.co/BIrGcex54y,happy,126,unmissable summer show opens tonight en route via
1603,@spacedlaw I was at the @britishmuseum earlier today and thought if you.. http://t.co/4kNHN8ojXB,nocode,96,i was at the earlier today and thought if you
1604,#UK to try to block departure of #Cezanne painting &gt; http://t.co/hILLrpQI5e @edvaizey @FitzMuseum_UK http://t.co/0U7seGXmGG,nocode,126,uk to try to block departure of cezanne painting
1605,@FitzMuseum_UK  It's beautiful - the colours are so lush and vibrant!,happy,69,it s beautiful the colours are so lush and vibrant
1606,"#NG365 Cornelis Bega's ""An Astrologer"" (1663) @NationalGallery #art #twitart http://t.co/9j0EVzsE3T",nocode,99,ng cornelis bega s an astrologer art twitart
1607,It's amazing &amp; uplifting to visit @NationalGallery in #London. Art is the way to purify the soul @GreatestCapital https://t.co/FtvPHYJAxt,happy,141,it s amazing uplifting to visit in london art is the way to purify the soul
1608,"@lisaj2108 @classarch @FitzMuseum_UK the Herakles one? Yes, found it very  interesting!",happy,87,the herakles one yes found it very interesting
1609,@LabbyTheRat is sending us to @RAMMuseum this Friday. Come to see the latest 3D visualisations of weather forecast data,nocode,119,is sending us to this friday come to see the latest d visualisations of weather forecast data
1610,#JamesRichards combines new installation with turbulent #francisbacon at @_TheWhitechapel http://t.co/oQS2NChfKB http://t.co/jgA4SNombE,nocode,135,jamesrichards combines new installation with turbulent francisbacon at
1611,"Lost in the exquisite crosshatching of this Hendrik Goltzius silverpoint self-portrait @britishmuseum, on view @ngadc http://t.co/KvakpZhVbb",happy,140,lost in the exquisite crosshatching of this hendrik goltzius silverpoint self portrait on view
1612,"#Repost @britishmuseum ・・・ Cupid finds Psyche in this watercolour by Edward Burne-Jones, who died… https://t.co/QrRFufm0YK",nocode,122,repost cupid finds psyche in this watercolour by edward burne jones who died
1613,@marmitage_ @looknorthBBC @NationalGallery @Tate @BBCBreaking @BBCSheffield #freethenipple,not-relevant,90,freethenipple
1614,Testimonis de la civilització assíria procedents de Nínive amb 3500 anys d'antiguitat al @britishmuseum avui http://t.co/T5gIjw2Rsf,nocode,131,testimonis de la civilitzaci ass ria procedents de n nive amb anys d antiguitat al avui
1615,Loving the Monets at @NationalGallery in London.  #inspiration #creativity http://t.co/JvGPYMudFB,happy,97,loving the monets at in london inspiration creativity
1616,Book spotting at @kettlesyard the other week http://t.co/gvoyP0XCgM http://t.co/7UKwsDPucb,nocode,90,book spotting at the other week
1617,@britishmuseum wonderful ....gorgeous,happy,37,wonderful gorgeous
1618,@NationalGallery #AskTheGallery Nicholas Penny: Will you reinstate Candy Unwin who a judge believes was dismissed for Trade Union activity?,not-relevant,139,askthegallery nicholas penny will you reinstate candy unwin who a judge believes was dismissed for trade union activity
1619,Great visitor services from @kettlesyard who sent me a new bag for life when mine was faulty - will muss you dearly! #thankyou,happy,126,great visitor services from who sent me a new bag for life when mine was faulty will muss you dearly thankyou
1620,@sallyfryer1 @karolinaglusiec is putting all of the shots together so will be on @kettlesyard website soon,nocode,106,is putting all of the shots together so will be on website soon
1621,#DefiningBeauty @britishmuseum stunning. See it while you can - awe inspiring and uplifting.,happy,92,definingbeauty stunning see it while you can awe inspiring and uplifting
1622,FREE PENS GIVEAWAY on our FB page... @plymouthart @PlymArtsCentre @PlymouthMuseum @plymlibraries http://t.co/0NuvMPbxTr,nocode,119,free pens giveaway on our fb page
1623,Another lovely visit to @_TheWhitechapel I'm always delighted &amp; uplifted by the Children's Commission showing the wonderful school projects,happy,143,another lovely visit to i m always delighted uplifted by the children s commission showing the wonderful school projects
1624,@NationalGallery http://t.co/fVxg4DiRd5 please contact @lancsCC today and stop this destruction of fertile lands. @fractivist @Frack_Off,not-relevant,136,please contact today and stop this destruction of fertile lands
1625,19thc Aussie indigenous resistance leader Jandamarra weapons @britishmuseum: http://t.co/CiW59aU1cy #twitterstorians http://t.co/thsHIAzYxs,nocode,139,thc aussie indigenous resistance leader jandamarra weapons twitterstorians
1626,@Culture24 @britishmuseum EXQUSITE!,happy,35,exqusite
1627,Jericho skull (ME 1274142) &amp; Amenhotep III (EA 3) and a glass of rosé with @sarahdawnscott @britishmuseum,nocode,109,jericho skull me amenhotep iii ea and a glass of ros with
1628,"@newmanmpaul no need to worry, everyone else knows anyway. You are a very lucky man :-) @SimonEvolver @ThelmaHulbert",not-relevant,116,no need to worry everyone else knows anyway you are a very lucky man
1629,.@_TheWhitechapel @marieantoynette Definitely one our our favourite places too! We're absolutely thrilled we're now a short walk away!,happy,134,definitely one our our favourite places too we re absolutely thrilled we re now a short walk away
1630,Mini-potter around @britishmuseum galleries I rarely see - love the Clocks gallery &amp; the incredible automata #museums http://t.co/VR2kVF0daS,happy,144,mini potter around galleries i rarely see love the clocks gallery the incredible automata museums
1631,There's still time to enter our art DVD and book bundle giveaway. Find out more here: htt... http://t.co/DgKCO1nVZQ via @NationalGallery,nocode,136,there s still time to enter our art dvd and book bundle giveaway find out more here htt via
1632,"Saw these and thought of you @EgyptMcr #AnimalMummies (EA 6773, 11134, 6752, 26847) @britishmuseum #GiftsForTheGods http://t.co/OVDXEm2ieX",happy,138,saw these and thought of you animalmummies ea giftsforthegods
1633,"I'm at @NationalGallery in London, Greater London w/ @sivia_t https://t.co/8sSfw4gBz5",nocode,85,i m at in london greater london w
1634,@NationalGallery @Postgate do today's visitors to a picture gallery have different expectations to those of yesteryear?  Can you illustrate?,nocode,140,do today s visitors to a picture gallery have different expectations to those of yesteryear can you illustrate
1635,#artnews for your Sunday afternoon: fantastic new exhibit @NationalGallery http://t.co/RgeZtedTWk. We &lt;3 #DCmuseums!,happy,119,artnews for your sunday afternoon fantastic new exhibit we dcmuseums
1636,Just a little bit excited! The Castle Hill Open Day 2015 schedules have arrived @kettlesyard :)… https://t.co/6pWVeB3ypU,happy,120,just a little bit excited the castle hill open day schedules have arrived
1637,FINALLY it's #DefiningBeauty @britishmuseum day! Can't wait to feel overwhelming awe.,happy,85,finally it s definingbeauty day can t wait to feel overwhelming awe
