,emotion,clean_text
948,happy,interest varieti
949,happy,delici dorset crab avocado gazpacho beauti gailsmithflow
950,not-relevant,none
951,happy,look forward public engag event defeatdepress even
952,happy,greatest car park attend countri ever seen
953,nocode,listen ebb flow summer gerald
954,happy,earli morn view defin beauti quit inspir rest day complet treat
955,nocode,place tree diagon axi rousseau convey sen wind
956,nocode,someth ancient egypt
957,happy,enjoy afternoon artheal
958,nocode,prefer art fast car fund manag help british museum buy picasso work picasso
959,happy,look forward visit week art cambridg
960,happy,frame work art visit free sansovinofram exhibit http via
961,happy,introduc director neil macgregor germani memori nation cheltlitfest tomorrow come
962,happy,definingbeauti final visit exhibit close next week well worth trip london brilliant time
963,nocode,london greater london
964,nocode,turn exposur paint enabl easier view toodark
965,nocode,como se la serpient mexica de do cabeza color en el no en
966,happy,seen christoph william show finish sunday go realli go go
967,happy,sad amaz excit thing happen
968,nocode,donat somebodi recal vagu
969,happy,portraitur fascin love hidden mean thank info
970,happy,weekend get better better grantsimonrog take dailyguidedtour entertain engag group
971,nocode,art london ttot lp vacat trip photographi photo travel travelp
972,happy,thank
973,happy,thank rt follow back great see repres defeatingdepress
974,nocode,weekend louvr pebbl close year go visit chanc
975,nocode,tourist
976,nocode,miss event showcas juli eventprofsuk london
977,nocode,muse adult art group enjoy watercolour paint inspir visit ruskin turner element natur show
978,happy,rare delight quiet light summer even splendid
979,happy,ye met tlkg abt amaz number visitor got
980,happy,great baramundi fish clive loveless aborigin art moment show
981,nocode,e
982,nocode,f r all v ter unter un fathersday
983,nocode,final weekend year closur complet build project sunday place
984,not-relevant,make like paint photo pl exibit would possibl
985,nocode,british museum abstract art ornament aesthet bronz age britain ireland
986,not-relevant,nd genocid biafran day unreport aerial bombard crossriv biafraland
987,nocode,watch short piero della francesca baptism christ cet ikonotv
988,happy,look forward soundscap hear paint see sound intriguingli entic
989,nocode,lo vist el tuit popular de hoy entr la persona que sigo por
990,happy,st ive cornwal news stori via
991,happy,fascin bit art histori thank love albrecht durer art gloria pool rn artist missouri
992,nocode,st conal cael bell shrine centuri shrine centuri doneg counti museum loan
993,nocode,everi good painter paint jackson pollock come soon
994,nocode,chanc see artist friend sarahturn
995,angry,askthegalleri noprivatis reinstatecandi
996,happy,search treasur posse museum treasur could imagin
997,happy,thank like say go
998,nocode,discus darren pih richard hawkin hijikatatwist
999,happy,spectacular gem renais jewelleri new waddesdon bequest galleri go admir
1000,nocode,bonapart interview astronom milan c waterloo
1001,happy,start sister hen excel idea v friendli secur guard
1002,nocode,warmemori workshop come area plea help u save war memori
1003,happy|surprise,intrigu portrait text wall pictur ladi bean
1004,happy,love nation galleri beauti
1005,nocode,visit giovanni di paolo four bapistpredella panel includ birth john baptist
1006,nocode,painter jacksmith bornthisday
1007,happy,sadli session run older peopl museum
1008,nocode,cambridg world famou close two year major redevelop
1009,happy,london today visit obligatori great court shot
1010,happy,wow great see hope get new app soon
1011,nocode,ff
1012,happy,exquisit work painter paul ruben present
1013,nocode,none
1014,happy,bustl wind r blow amz paint sen almost feel sea air paint
1015,happy,proud member could work put book ticket member
1016,happy,thank first show saw paint display sever known today
1017,nocode,tomb nebamun bc egyptolog archaeolog ancientegypt
1018,happy,real must see defin beauti bodi ancient greek art london art
1019,nocode,top stori tall napoleon say tonight jose see
1020,not-relevant,bame applic esp welcom year cultur traineeship deadlin june
1021,nocode,ye real man made discov
1022,nocode,greav
1023,happy,incred jewel new galleri
1024,nocode,
1025,nocode,aunt fanni say simpli wizard enid blyton exhibit come
1026,nocode,none
1027,nocode,lie beneath draperi suggest form via
1028,angry,bobandroberta angri artist profil speak foundationcours
1029,nocode,bodi beauti bearer mean last day defin beauti bodi ancient greek art exh end jul
1030,happy,glow star jackson pollock review art nervou breakdown majest
1031,nocode,none
1032,happy,cool statist well done
1033,happy,tire sleepov seat train london nottingham either didgeridoo man dreamtim tale great
1034,nocode,weekend tri christopherwilliam stage photograph
1035,nocode,final chanc frame art end midnight tonight enter sunshin code
1036,angry,bobandroberta angri artist profil speak foundationcours
1037,nocode,reconnect mongolian siberian peopl histori new exhibit river star reindeer
1038,nocode,mennesk balk vard hu festn london n er bildet tilbak bergen
1039,nocode,tour inspir town tate britain retrospect open
1040,sad,shame idiot post rude comment throughout
1041,nocode,london greater london
1042,happy,great insight barbarahepworth show exhibit explor art
1043,nocode,interview director preview next month extravaganza see u
1044,happy,better way get creativ inspir go museum
1045,happy,love bomberg jujitsu new life find express new art
1046,nocode,ng jacob van ruisdael rocki hill three cottag art twitart
1047,nocode,never knew one
1048,happy,stylish ceram talent artist anthonytheakston pelicanjug ceram
1049,angry,askthegalleri dr p like leav nobl gestur stop privatis reinstatecandi support union
1050,nocode,c zann masterpiec loan risk sold abroad
1051,nocode,pollock ligon press view lsad graduat
1052,nocode,steve uk art creativ daili stori via
1053,nocode,bpportrait photographi award
1054,nocode,volunt need artist room gerhard richter deadlin fri juli artopp
1055,nocode,day japanes embassi
1056,happy,fabul thank
1057,nocode,abba song
1058,nocode,lesson death live juli jon underwood christina bradstreet
1059,nocode,last chanc catch defin beauti bodi ancient greek art
1060,nocode,weapon resist jandamarra hero bunuba peopl via
1061,nocode,artist impress summersolstic bertram buchanan earli th centuri
1062,not-relevant,thank recent follow happi connect great sunday via
1063,happy,fabul day greek beauti australia napoleon propaganda much
1064,nocode,soundssublim festiv return jul free event
1065,happy,delic delight eye art
1066,happy,fab indigen australia exhibit visit close
1067,happy,fascin thank post
1068,nocode,look egyptian judg shape guess mummifi young crocodil
1069,nocode,come sat see pm interest archiv materi architectur
1070,nocode,brief visit back home
1071,nocode,london greater london
1072,nocode,prepar close two year director live
1073,happy,fascin mtg meet curat mgmt discus closer work link school museum resourc histori
1074,nocode,support give insight degre subject post subject taster week
1075,nocode,askthegalleri much receiv sponsorship fee shell brand rembrandt exhibit
1076,happy,went indigen australian exhibit even fascin fabul mani dot
1077,not-relevant,none
1078,nocode,none
1079,happy,ancient roman wed ring see clasp hand like novel summer fire
1080,happy,one favorit also
1081,nocode,watch report pollock
1082,nocode,ragani vasant manley ragmala c mughalmonday
1083,not-relevant,hey check nation sing competit open mic uk open type act age
1084,not-relevant,none
1085,nocode,london greater london
1086,nocode,sign e news could win exhibitiononscreen dvd
1087,happy,make heart sing see elgin marbl inspir art
1088,happy,great tour enjoy five servic
1089,nocode,jim bathroom find old glass milk bottl fill foxglov nigella
1090,nocode,world exhibit open tonight octob learn legend
1091,happy,nice one
1092,happy,thank much amaz defin beauti exhibit aesthet feast
1093,nocode,tomorrow open jackson pollock blind spot
1094,not-relevant,second genocid biafran promis buhari begun day unreport aerial bombard biafra
1095,happy,today perfect enough gelato affogato
1096,nocode,new trailer mani beauti thing ft michelledockeri releas via
1097,nocode,gay sculthorp curat oceania
1098,happy,wonder unpopul
1099,not-relevant,say wick witch pnw realli deborah good witch uppermw
1100,not-relevant,ceri ann art administr enjoy weather recki castl hill open day sign
1101,nocode,miss jame richard sonic instal franci bacon studi portrait
1102,happy,love day discoveryday thank artseduc
1103,nocode,tomb nebamun bc egyptolog archaeolog ancientegypt
1104,nocode,own art
1105,happy,fantast
1106,nocode,histori avant gard museolog arseniyzhilyaev convers thur juli pm
1107,nocode,link por e el tuit popular en mi news feed de hoy
1108,nocode,e noi rispondiamo
1109,nocode,discov art social medium noho featur artist blandin bardeau hermoin carlin
1110,nocode,helen wilson talk cda phd work w innov techniqu add cdavalu
1111,nocode,london civilisedbodi talk greek bodi even day bodi
1112,nocode,ff
1113,happy,tri spot life draw fabul cambridg
1114,happy,art museum open whole new world child via
1115,nocode,near today join line perform talk artist led workshop
1116,nocode,thank sir
1117,nocode,way morn press view new jackson pollock show
1118,happy,thank tonn also love podcast neil macg intrigu say least faeri tale real
1119,happy,fascin thank odd place exil anyon
1120,nocode,old master teach u live meaning life via
1121,nocode,think crown
1122,happy,import talk would love visit haida gwaii
1123,not-relevant,ye
1124,nocode,none
1125,happy,miss look next time
1126,happy,excit le week jacksonpollock exhibit start cantwait
1127,happy,sooo romant
1128,nocode,free cpd afternoon war game exhibit thur jul pm plymouth detail
1129,happy,look forward amelia smith speak cda innov showcas cdavalu
1130,happy,defin beauti exhibit wonder look bodi greek art like home
1131,happy,gloomi weather get go last day yr refurb instant feel good fun
1132,nocode,could alway read art therapi
1133,happy,absolut amaz space venu shakespeareantc summer drink parti
1134,nocode,staff truste manag inform friendli open chat clear air
1135,not-relevant,week left appli head market role could play signific part success
1136,not-relevant,nd genocid biafran promis buhari begun day unreport aerial bombard biafraland
1137,happy,must take time take enjoythemo
1138,happy,art updat readi new guest hope like elisabethclark poster
1139,happy|surprise,love indigenousaustralia exhibit aft although surpris paulkeat speech featur timelin
1140,happy|surprise,ye day enough futureofmuseum heard
1141,nocode,philgrabski latest blog share interest articl relat exhibit durand ruel
1142,nocode,british museum bonapart british
1143,nocode,steve uk art creativ daili stori via
1144,happy,fascin thank post
1145,happy,view bad caf either
1146,nocode,good question answer
1147,happy,summertim cambridg run fli sit around sing
1148,nocode,got interest talk come feel free add site
1149,happy,inspir architectur saw rosetta stone mani cool treasur
1150,nocode,gone elsewher year notic leed gaudierbrzeska show
1151,happy,thank much x
1152,nocode,learn pollock black paint stun catalogu show
1153,nocode,hundr wool scrlj
1154,happy,great day far castlehil
1155,nocode,symbol frm past attitud toler never fix constantli negoti
1156,nocode,miss brilliant christoph william show close tomorrow
1157,nocode,pop danc north cambridg accademi castlehil
1158,happy,good see film miss roll hill real time materialhistori
1159,not-relevant,hire graduat traine fundrais paid year full time deadlin
1160,happy,spent morn learn mummi fascin well present right balanc object info interact
1161,happy,jackson pollock blind spot open june wait art liverpool
1162,nocode,oop
1163,happy,europa seem quit happi abduct bull zeu
1164,happy,realiz abl see mummi exhibit happi
1165,happy,work meet great start day
1166,nocode,soundscap open soon
1167,nocode,mosqu
1168,nocode,barbara pezzini lectur modern british art next monday cdpphd
1169,nocode,napoleon defeat british afraid today
1170,nocode,local class
1171,not-relevant,none
1172,happy,interest articl cabinet curio
1173,nocode,draw defin beauti exhibit
1174,sad,crumb dudley post henri viii feel bit threaten museum tweet cathol today
1175,happy,ye plea
1176,happy,take awalkonthewildsid today visit art galleri free admiss print much visitk
1177,happy,wellcom instagram time instamuseum tomorrow
1178,nocode,headless one photo london flickstackr
1179,nocode,london greater london
1180,nocode,syracus greek coloni coin demareteion bc paolo orsi museum
1181,nocode,publish art write sam thorn scorecard critic cite male femal
1182,nocode,shield
1183,nocode,elimin ancient blind scourg trachoma africa talk juli
1184,not-relevant,anyon know artist china need assist oct pl rt spread word
1185,happy,cambridg bound fulfil lifelong dream see mayb punt travel england cambridg
1186,happy,look interest upcom archaeolog childhood exhibit histchild twitterstorian
1187,nocode,tonight learn irish waterloo
1188,happy,best camden famili learn today event
1189,nocode,yup
1190,happy,barbara hepworth studio must visit
1191,nocode,colbetween dutch painter common hackaert berchem paint stag hunt forest
1192,happy,fantast open night sir terri frost wonder curat
1193,nocode,today feast day john baptist explor life art
1194,nocode,kessel canaletto feast day saint roch depict temporari exhibit object
1195,nocode,anoth pictur outsid london
1196,happy,realli enjoy exhibit today want find
1197,nocode,england nation shopkeep napoleon bonapart
1198,happy,thank post amaz share social medium
1199,nocode,led st ww led fascism stalin hitler
1200,nocode,roman devon devontop romanbritain romandevon archeolog devon
1201,nocode,happen today flaminproduct book essenti
1202,happy,mind st ive garden one favourit place
1203,nocode,nigella aquilegia caught amongst scroll grace speed bird gaudierbrzeska helen bedroom
1204,nocode,gare rue vert rouen cyril power c
1205,nocode,min til dan snow live th anniversari waterloo bonaparteandthebritish
1206,nocode,realli horribl thought margin better teeth suppos
1207,nocode,londr
1208,angry,striker rais protest reinstatecandi
1209,nocode,u post breastfeed nat l celebratebreastfeed week th june
1210,nocode,stoneheng summer solstic sun rise behind slaughter stone bertram buchanan v
1211,happy,world premier jan hope anoth screen soon
1212,happy,clandestin pic old compton st soho
1213,nocode,today view
1214,not-relevant,hard reduc price rail travel given er privatis
1215,happy,find great content produc periscop like
1216,angry,upset invigil rude arrog enforc drink rule
1217,nocode,lunch break insect altern protein
1218,nocode,london greater london
1219,nocode,obligatori great court shot
1220,not-relevant,link del el link popular entr la gent que sigo e por
1221,happy,bingethink exhibit day definingbeauti indigenousaustralia ancientl breathtak
1222,nocode,today final day enter art dvd book bundl giveaway via
1223,happy,wondrou day liverpool mindart peter blake razzl dazzl ferri brilliant
1224,happy,hahaha still serious beauti head smell strong smell xx
1225,nocode,castlehil today miss famili fun pm could
1226,nocode,want learn indigenousaustralia follow u rt may win ticket benugoticket
1227,happy,great see panel circuit today
1228,happy,took pictur archiv coolest sea monster ever
1229,nocode,ye genesi group start exhibit first group show
1230,nocode,senior rabbi lead compos director given honorari degre
1231,happy,realli wonder
1232,angry,fyi reinstatecandi
1233,nocode,start read particip clairebishop thank
1234,nocode,look special way spend fathersday got lot great event choos via
1235,happy,look forward amelia smith speak cda innov showcas cdavalu
1236,happy,second day inspir artist
1237,angry,commerci collegi fee art loan abu dhabi disclos uk foi law
1238,happy|sad,sad see close know back bigger better make tini bit better
1239,happy|sad,spent even stop smile altho sorri read room close
1240,nocode,end first day object even visit museum
1241,nocode,cultur land health entwin indigenousaustralia
1242,nocode,greek inscript sitter cap work translat ala desir much bit like
1243,happy,look forward glenn ligon jackson pollock open tonight
1244,happy,congratul traine fantast baroqu redisplay
1245,nocode,mt anglo saxon drink horn taplow burial late th c ad display mead
1246,nocode,appear without trace nicolecoson
1247,nocode,bodi work portray emot happi wide acquir public art
1248,nocode,join australia hous talk indigen australia tuesday rd june
1249,surprise,weird say barberinstitut took pic
1250,surprise,cod piec made armor
1251,happy,would love could attend diy poetri illustr booklaunch sunday thankyou
1252,happy,work art enjoy jackson pollock cupcak press view today tast
1253,happy,excit even shakespear larg canap recep banquet hous nd eve row
1254,happy,awesom
1255,nocode,review indigenousaustralia endur civil institution indigen art heal
1256,nocode,hapsburg jaw evid
1257,happy,thank visit card
1258,happy,treat see name closer look amaz textil survivor
1259,happy,look forward sleep tomorrow much cart sleep bag around london
1260,nocode,twitter pictur would give best chanc recognit
1261,nocode,read director nichola penni say begin juli via
1262,nocode,
1263,not-relevant,sorri member mean
1264,nocode,ng jacob van ruisdael pool surround tree art
1265,happy,tri spot life draw fabul cambridg
1266,nocode,top art show c london
1267,not-relevant,absolut da verkaufen liegt den berlin museen nicht wirklich
1268,happy,hahaha show woman eavesdrop saw go spot right
1269,nocode,khufu found cheop gefunden build high pyramid interakt ebook
1270,nocode,gustav caillebott painter eye washington
1271,nocode,pick copi beauti catalogu cabinet curio blue caravan
1272,happy,day dream date fine fella adventureswithtuck
1273,happy,pretti cool
1274,happy,love thought young woman amaz grace mani bear disabl
1275,nocode,view tonight sleepov
1276,happy,new galleri exhibit hit visitor
1277,happy,preciosa muy representativa
1278,nocode,speech lord includ noprivatis reinstatecandi reinstatecandi
1279,happy,excit castl hill open day tomorrow load great stuff famili free
1280,not-relevant,parmi le grand neig de monet gusta
1281,nocode,greek bodi tonight panel classic nation greek bodi enlighten europ
1282,happy,thank much
1283,happy,tate also one favourit via twitter
1284,angry,peopl care paint v cheap temporari contract unknowledg staff askthegalleri
1285,nocode,postgradu student visit galleri
1286,nocode,tarot garden took year open
1287,nocode,palm contemporarybritishartist modernist
1288,nocode,link day popular link among peopl follow
1289,angry,askthegalleri recommend truste end oil sponsorship make ppl complicit climat chang see public art
1290,happy,wonder
1291,not-relevant,second genocid biafran promis b buhari begun day unreport aerial bombard biafralland
1292,happy,rememb experi defin pair chair throughout peac sociabl
1293,happy,look forward unveil jacksonpollock exhibit tonight corporatesupport liverpool cultur
1294,nocode,limit print avail order
1295,happy,love sketch w part juli jackson wksp
1296,happy,love wow realli interest
1297,nocode,art london ttot lp vacat trip photographi photo travel travelp
1298,happy,mess curatori kittygod sekhmet bastet
1299,nocode,plea confirm cost employ ci staff rembrandt exhibit sainsburi wing askthegalleri
1300,nocode,chair board hannah rothschild ff rothschild bd gaza
1301,nocode,share learn mind session rachel research silenc galleri magwellb
1302,nocode,call indiana jone explor extraordinari guid museum ingeni galleri trail
1303,happy,new wing night stun
1304,angry,drink permit museum clearli display entranc
1305,happy,call art teacher great opportun see forthcom exhibit art liverpool
1306,nocode,april june greek god hero exhibit british museum museumhistori exhibit
1307,nocode,lovewin georg seurat tude pour baigneur asni re
1308,happy,loveart
1309,nocode,wait tomorrow wonder watercolour element natur open june
1310,happy,fantast afternoon explor
1311,happy,fantast open night sir terri frost wonder curat
1312,happy,radiant certainli worth anoth look jackson pollock late work
1313,nocode,pineappl shape knob rail outsid fitzwilliam museum object
1314,happy,event team visit today prepar forthcom event
1315,happy,longest day yet neither earliest sunris latest sunset
1316,nocode,castl hill open day
1317,nocode,una greba
1318,happy,huge east london art wander today keep art local
1319,nocode,volunt need artist room gerhard richter deadlin thur sept artopp
1320,nocode,join best digit interactldn oct ux ia design
1321,not-relevant,
1322,happy,indigen australia realli worth look
1323,nocode,jackson pollock gave paint via blind spot june octob jackthedripp
1324,nocode,might appl
1325,happy,delight work select evolv prize look forward show
1326,disgust|angry,happili profit display artefact uneth obtain countri oppress invas
1327,nocode,head prep talk ticket sale interactldn
1328,happy,look like kind parti
1329,happy,capit day remind everyth use know bout statu vase definingbeauti susanwoodford
1330,happy,thank andrew nairn director share insight student today
1331,nocode,etch ovid metamorphos artist salvat rosa born otd
1332,happy,incred innov part use dprint uncov past histori tech
1333,happy,gloriou site darkroom readi use film
1334,nocode,london greater london
1335,nocode,done respect think gener ok see tough call
1336,happy,amen
1337,happy,st ive beauti whatev weather book octob
1338,nocode,cambridg univers grant honorari degre great eight includ director
1339,not-relevant,art galleri cornwal set undergo expans remodel engin
1340,nocode,discov nake truth behind greek art exhibit run th juli
1341,nocode,none
1342,nocode,ask co napolean use say armi march stomach
1343,happy,ph nom nal merci
1344,happy,thank book prize draw
1345,nocode,revisit fossil sea scorpion use world largest spider evolut oldfriend
1346,happy|sad,beauti exhibit fabul space tad asham time took u rememb oedipu trilog name
1347,happy,beauti rt immeris new exhibit soundscap open juli
1348,nocode,happi birthday ruben born onthisday samson delilah room
1349,happy,great pub fond holiday memori
1350,nocode,leg shield guard mayb
1351,nocode,chanc definingbeauti exhibit extend
1352,nocode,week last week peopl visit kettl yard castl hill open day sat
1353,happy,one proudest moment
1354,nocode,even guy agre schwarber player game
1355,nocode,exhibit open look forward week includ ruskin turner
1356,nocode,still
1357,nocode,british museum collect object detail
1358,happy,good unobtrus use technolog revamp waddestonbequest esp palmer cup
1359,nocode,parad shield
1360,happy,sun time holiday plan summer museum programm readi brow
1361,nocode,lisa may thoma explor human touch touch diari film premier juli
1362,nocode,brexit give back parthenon statu greec put michel constant spipe instead
1363,happy,art enthusiast miss love everi minut pic
1364,nocode,guter punk
1365,nocode,whole magritt exhibit
1366,happy,love museum
1367,nocode,two work art made yr apart see sir caro take duccio annunci free entri
1368,happy,congratul last day thrill renov delight share journey
1369,nocode,curiosa exposici n monogr fica de marco sansovino en de londr hasta el
1370,happy,truli love even definingbeauti thank everyth superstar
1371,happy,thank great afternoon saturday fascin film convers theartistspres
1372,happy,great tonight hear defeatingdepress lot person stori hope futur timetochang
1373,happy,afternoon go good one
1374,nocode,favourit exhibit sinc
1375,happy,wonder morn thank u learn team cornwal
1376,nocode,would abl help paint info copenhagen harbor
1377,happy,enjoy demonstr must take year master beauti artistri
1378,nocode,know mani time walk staircas
1379,angry,askthegalleri dr penni face public outcri petit nearli signatur halt privatis
1380,nocode,monet marri wife camil onthisday
1381,nocode,visst du att british museum london bara visar av hela sin saml
1382,happy,may stun exhibit
1383,nocode,miss ming exhibit last year bring speed
1384,happy,perfect weather weekend arm forc day plymouth
1385,happy,look amaz cece fifi beau prob bit old
1386,nocode,peri today
1387,not-relevant,nd genocid biafran promis buhari begun day unreport aerial bombard biafraland
1388,angry,solidar strike nation galleri privat tuclgbt
1389,happy,hedg bindwe forc peckham plant grow around st helen amaz pendant
1390,happy,thank much david
1391,sad,lot question privatis sack rep askthegalleri v disappoint address
1392,happy,love sure royal way much money
1393,not-relevant,ff happi friday
1394,nocode,close portlandvas roman cameo glass
1395,nocode,ye describ come one world first mass grave
1396,nocode,last one current polit
1397,happy,enjoy british librari crime classic seri bought hatchard
1398,happy,workshop today manchu money great money stink thank
1399,happy,longest day new begin big posit chang come day
1400,happy,thank look great
1401,not-relevant,none
1402,happy,nation galleri love train help access
1403,nocode,richard iii becam king england onthisday show juli aug via
1404,happy,thank
1405,happy,piero della francesca one favourit piec ever
1406,sad,sinc includ would nice see felt like concessionari nod
1407,nocode,leav horniman commun group
1408,nocode,bodi import subject art ancient greec god sport star
1409,not-relevant,carlemagn
1410,not-relevant,grazi ffback
1411,nocode,weapon resist indigenousaustralia curat gay blog jandamarra
1412,not-relevant,come ca art liverpool get creativ outsid tri tabl
1413,nocode,st eleftherio greek school trip british museum see britishmuseum
1414,nocode,plu recent evid survey
1415,happy,realli enjoy earli morn visit definingbeauti lot work even seen book bmimag com
1416,happy,support great event rd year sat th june pm pm
1417,happy,studio work done joy
