,emotion,clean_text
0,nocode,merci pour le partag
1,happy,dorian gray rainbow scarf lovewin
2,happy,replac wish artist use next instal entral
3,happy,thank follow back great hear diver interest panel defeatingdepress
4,happy,beauti jewel portrait r rex
5,happy,alway love paint
6,nocode,say wot mate
7,nocode,two workshop evalu audienc engag earli juli
8,nocode,forest road thoma gainsborough oil canva
9,happy,lucki good luck see soon
10,nocode,non arr te mon brush l alma favourit custom bonlundi
11,nocode,two work free ducciocaro exhibit play space movement architect via
12,happy,yr art student today enjoy
13,nocode,inde
14,nocode,waterloo live periscop tonight dan snow bonaparteandthebritish
15,not-relevant,plea vote u sidwel local chariti prt
16,not-relevant,askthegalleri got plan privatis role
17,nocode,new digit instal girton artist resid project fa ade tonight pm
18,happy,beauti
19,nocode,sussanna pic
20,happy,awesom museum
21,angry,askthegalleri pay brilliant staff poorli
22,nocode,sneak peek indigenousaustralia exhibit
23,nocode,agre count day till see
24,nocode,bennicholson
25,nocode,cours instamuseum
26,happy,soo beauti
27,happy,
28,happy,one favourit paint great artist
29,nocode,free cpd afternoon war game exhibit thur jul pm plymouth detail
30,happy,magna carta exhibit quit extraordinari imagin done even bit toni hancock
31,not-relevant,peopl sign worth miss book cdavalu phdchat ahrc
32,nocode,none
33,happy,kudo top flight wc exhibit
34,nocode,jack blog museum keep tech youngster collect
35,nocode,none
36,happy,ooh plea let u know
37,not-relevant,miss cornwal much ff
38,not-relevant,membership plu offer
39,nocode,spain egypt
40,happy,enjoy amaz collect famili
41,nocode,dwen brooch stori anglosaxon ladi film exhibit
42,happy,beauti paint thank
43,happy,definingbeauti truli breathtak exhibit fascin portray woman
44,nocode,haha case
45,nocode,great court london photographi
46,nocode,none
47,nocode,one thing innit
48,nocode,discov art social medium noho co founder rod mcintosh noho origin london art
49,happy,thank favourit follow back mum great job defeatingdepress
50,happy,treat end june follow jacksonpollock perfect summer
51,nocode,ivana moonlight hepworth
52,happy,one best place countri
53,nocode,rosetta stone
54,nocode,gemma visit australia today fail find hemsworth keep tri austriangp oz
55,happy,awwh possum
56,nocode,two week see exhibit roman food stun object corinium
57,happy,wonder experi hear tim knox object keynot content decor uk countri hous galleri
58,nocode,littl bit waterloo histori today
59,happy,hooray win evolv prize see juli
60,happy,fabul enid blyton exhibit great kid age
61,nocode,castl hill open day start art danc famili activ tour talk nuclear bunker castlehil
62,nocode,battl control drum messag regiment respond wrong drummer instruct
63,nocode,coffin babi
64,nocode,import art true cultur effect counter cultur violenc
65,nocode,alla buon os ti ho trovato finalment london greater london
66,happy,enid blyton exhib n open wed june help set
67,happy,kettl yard antimuseum meet archivist buzz castlehil explorearch
68,nocode,lot director confirm tri buy export ban cezann
69,happy,week write report report suddenli brighten thought definingbeauti tomorrow
70,not-relevant,la fama vien va
71,happy,samba time discoveryday
72,not-relevant,nd genocid biafran promis buhari begun day unreport aerial bombard biafraland
73,happy,lot ancient artefact enjoy amazingplac toomuchforaquickvisit
74,nocode,london greater london
75,nocode,st georg slay dragon german th centuri paint wooden church statuett
76,happy,plu excel prize
77,happy,feliz cumplea o ruben happi birthday ruben
78,nocode,behind wall
79,nocode,midweek better girl x
80,nocode,see christoph william product line happi via
81,angry,messag oil sponsorship art send ngotiat climat deal pari year askthegalleri
82,nocode,unesco veneto opera una nuova idea di bellezza per l italia e il mondo su
83,nocode,big pocket requir rt ancient roman version swiss armi knife rd centuri ce
84,not-relevant,mp debat privatis tomorrow pc strike continu ask mp attend
85,happy,love museum via
86,angry,attend adjourn debat tomorrow noprivatis reinstatecandi
87,nocode,none
88,happy,excel exhibit napoleon era caricatur print well worth look
89,nocode,london greater london
90,nocode,mesoamerican galleri lord shield jaguar ladi xoc yaxochilan summon spirit
91,not-relevant,today shortest day winter solstic wave
92,happy,love badg visit peel park
93,nocode,none
94,nocode,none
95,nocode,artcub student day stockleyart proudteach
96,not-relevant,followfriday
97,nocode,rememb waterloo satir print show explor ifpda
98,happy,de hooch courtyard hous delft u quit simpli favorit paint thank place center stage
99,nocode,terma underwat throne photo taken ian kingsnorth recent perform
100,nocode,look like artisticlic involv sketch summersolstic sunris stoneheng
101,nocode,new exhibit famou btw sturn
102,nocode,ye lovewin georg seurat tude pour baigneur asni re
103,not-relevant,actual longest day year june th next leap second ad
104,happy,grant help u acquir whistlejacket learn via
105,not-relevant,london london london
106,happy,amaz alway date best museum world thank
107,nocode,indigenousaustralia move exh effect colonis document peopl fight right countri
108,nocode,seen sand paint beach trouvil claud monet
109,happy,yum
110,nocode,korea china art london ttot lp vacat trip photographi photo travel travelp
111,happy,cours noth noth le eye horu greet
112,nocode,u respond compliment earlier
113,nocode,peninsula war st defeat napolean
114,happy,well deserv congrat
115,happy,love exhibit today mum especi love x
116,happy,task foreign weapon start real job day happi monday
117,not-relevant,vital profit nation institut let torus sell
118,nocode,user test print
119,nocode,lenin favourit painter
120,happy,got guess artwork arthistorydegre wellworthit
121,nocode,ruben massacr innoc
122,nocode,one delici coffe ever tackl greek exhibit
123,not-relevant,askthegalleri much spend employ ci staff rembrandt exhibit sainsburi wing
124,nocode,show hung miss christoph william product line happi
125,happy,young friend drawn u great pic insid new pencil castlehil
126,disgust|angry,cultur fund p r budget favour go paid
127,nocode,got paint london open coupl paint realiti open mid juli
128,nocode,artist larissa sansour discus use sci fi film june
129,angry,askthegalleri instat candi udwin art subject privat profit
130,happy,patient sharp ward enjoy histor view citi thank
131,nocode,rosetta stone exampl napoleon war brought egypt waterloo
132,happy,also privileg great london truli wonder arttherapi
133,disgust|angry,encourag violat men privaci assault woman advoc assault
134,nocode,bird cage repres infanc instrument repres youth armour repres strength manhood
135,happy,fantast london today speak event met love peopl
136,not-relevant,bright cloudi day sun behind cloud lot shadow mayb
137,nocode,open sourc event cm could need culturegeek
138,angry,askthegalleri take pride hang classic artwork hang staff dri
139,not-relevant,nd genocid biafran promis buhari begun day unreport aerial bombard biafraland
140,nocode,crisi age topic one day confer book free mandatori thx
141,nocode,walk british museum london art
142,happy,excit discus potenti practic challeng museum archiv research museumarch event juli
143,happy,thank
144,happy,thank luci co new rhythm new eye go educ studio prep saturday
145,happy,wonder book trip today fun way improv geographi knowledg map
146,nocode,london greater london
147,happy,london beauti vermeer inarttour masterpiec
148,disgust,ignor question sponsorship fee receiv shell surpris artwash
149,nocode,ceo n chandra welcom guest tc uk recept featur yr shakespear magic
150,nocode,jackson pollock
151,happy,sofaa dinner listen wonder main speaker tim knox
152,angry,fantast stand worker noprivatis sit fenc
153,happy,enjoy coupl hour side british museum lonelyplanet summer notsosunni
154,happy,long till blind spot exhibit jacksonpollock
155,nocode,lo vist el tuit popular de hoy entr la persona que sigo por
156,happy,incred help staff secur team support staff room galleri greatservic
157,happy,amaz job team bag massiv thank happi waterloo peep
158,nocode,attend adjourn debat tomorrow noprivatis reinstatecandi
159,nocode,exet redcoat readi come pic
160,nocode,defeat waterloo napoleon abdic second time via
161,nocode,art prize winner corin sworn creat new larg scale instal
162,happy,year ago today greatest museum open acropolismuseum givethemback elginmarbl greec
163,nocode,spartan suppos knew pose
164,nocode,beatric gibson present new film saturday book
165,not-relevant,none
166,happy,excel lunchtim visit afternoon definingbeauti exhibit
167,happy,perfect locat wear vanessagounden great court wearableart artiv
168,happy,whole trip free
169,nocode,reinstat candi tribun success askthegalleri
170,nocode,themepark leisur second phase cornwal tate st ive steam ahead
171,nocode,none
172,happy,prais
173,nocode,scope get art ideal complet exhibit outsid london nw mayb askthegalleri
174,happy,sutton hoo anglo saxon hoard includ icon helmet strike close
175,happy,look forward see australia exhibit soon take ancient greec exhibit
176,not-relevant,piss
177,nocode,evid correct christoph wood correct time frame
178,not-relevant,job develop offic exet close date juli museumjob
179,happy,work experi great
180,nocode,curiou know stori behind unsettl display
181,nocode,fran hal replac heavi pastich dutch th centuri rosewood mould frame
182,happy,thank tom help studi bronz age metalwork week phd read visit
183,nocode,toi q w writer filmmak first woman head improb love
184,not-relevant,trail disappear link page
185,nocode,henri viii crown king onthisday th centuri portrait holbein
186,happy,seen garden yet soon fan rhyme day
187,happy,visitor like weather millionth visitor today
188,nocode,get mood pollock make jazzi drip famili
189,nocode,cover ulyss nya joyc karya matiss
190,nocode,ancient live new discoveri
191,not-relevant,ich f rchte das auch dann die leut nicht kommen w rden sieh text warum
192,happy|surprise,erot paint bronzino leda swan michealangleo
193,happy,hear hear super interest
194,nocode,apart obviou skull idea
195,sad,oh dear dame laura knight sure beach list
196,nocode,none
197,nocode,follow uk newest royal babi post paint origin queen charlott
198,happy,ooh look good jackson pollock exhibit open th june
199,happy,noth footbal one tini bit excit pollock
200,nocode,ty also follow abstract film program
201,nocode,expo boissonnet french artist pari
202,not-relevant,piero della francesca baptism christ london tempera su tavola cm river
203,happy,ilovemuseum provid fantast opportun exploreyoursubject prospect applic univers
204,nocode,castl hill open day
205,happy,fantast perform kerri yong film part evnt sat
206,nocode,askthegalleri
207,nocode,grand old duke york
208,nocode,smooch
209,nocode,articul speaker present
210,nocode,none
211,happy,talk greek southern itali tomorrow rm pm happi memori gravina archaeolog
212,happy,one favourit artefact one favourit museum
213,happy,happi birthday main man sorri year young today great selfi
214,happy,ff happi weekend
215,happy,love choic
216,happy,jackson pollock glenn ligon open tomorrow great combo beauti nottobemiss
217,nocode,none
218,happy,best thing photographi guess
219,nocode,ancient egyptian place amulet onto mummi har supernatur power eye everywher
220,happy,hmmmmmmm nice
221,happy,good see yesterday work progress come togeth
222,happy,look forward glennligon talk afternoon
223,nocode,portrait doge leonardo loredan giovanni bellini display
224,happy,well worth catch end earli juli definingbeauti
225,nocode,come c stay choos go dazzleferri
226,happy,tomorrow london art day start afterward strong dose art
227,nocode,napoleon bandag haemorrhoid chang battl myth waterloo
228,happy,magnific would love learn hand
229,nocode,get child creativ juic flow imagin station special paper picnic time tom row free
230,happy,great modern british institut great piec fantast
231,nocode,al vil leo
232,nocode,podr tratars de la divinidad fenicia del cereal
233,happy,excelent colecci n
234,nocode,tomorrow galleri child commiss goe display featur work brazilian artist rivan neuenschwand
235,happy|surprise,give shiver everi time see aweinspir
236,happy,peachi morn excel defin beauti exhibit
237,nocode,may peac north south east west may peac throughout world druid summer solstic ah rite
238,happy,one favourit place contemporari art great discoveri today artinlondon galleri
239,happy,buzz wingit ldn rt wine clock nation cafe oliverpeyton tonight half price
240,not-relevant,ff
241,happy,great night cambridg zugub dancer torr strait
242,happy,thank love weekend x
243,happy,like use instagram show behind scene thing visitor might miss visit instamuseum
244,nocode,made virtual game art student work
245,happy,meet realli excit stuff exet grey day beauti breakfastofk
246,happy,love museum remind u other found way surviv also periwig great
247,happy,cambridg next visit look forward result
248,nocode,monument italian woman corot although best known landscap pai via
249,nocode,cfp confer negoti art dealer museum london april
250,happy,hidden watercolour treasur go display
251,surprise,turquois eye
252,happy|sad,saw indigen australia exhibit superbl present harrow vision colonis
253,nocode,weekend last chanc feat modern heroism printmak legaci napoleon richard billingham art
254,happy,thank ff
255,angry,seem quit clear copi unfair take one word appli entir thing
256,nocode,napoleon keep use column british line waterloo
257,not-relevant,ff
258,nocode,miss materi histori seminar inc linder dawn ade convers
259,nocode,would interest
260,happy,indigenousaustralia beauti enlighten thought provok well worth visit
261,nocode,ta releas sent clear amend
262,sad,place subtl danc piec perform ageuk defin beauti exhibit realli work bring back bacchant
263,nocode,pictur enidblyton exhibit plymouth museum via devon
264,nocode,one ch shivaji origin portrait hous marathilondon
265,happy,ooo bet good presentfilm
266,nocode,london miss cleveland get thee elit show
267,not-relevant,ppl cambridg peterborough final cast week shi film juli th th e clair gellard tv rt
268,nocode,tweetett time stori via
269,nocode,show imag move onto space work eight artist span year
270,nocode,ng willem duyster soldier fight booti barn c art
271,nocode,press view jacksonpollock blindspot
272,nocode,lot scholarli establish dismiss modern idea inapplic materi
273,happy,jackson pollock press view love theme spatter cupcak
274,happy,book film greek coffe curri perfect saturday
275,happy,brilliant tire trip nebula class today well behav great ambassador school
276,disgust|angry,excel point add lack decent medic servic suspect water suppli present fine
277,nocode,askthegalleri nichola penni pl reinstat candi unwin judg confirm sack trade union activ
278,nocode,turner
279,nocode,cambridg today check castl hill open day castlehil
280,happy,love afternoon amaz thank keep museum free
281,happy,miss
282,happy,great idea thank liverpool great citi amaz histori studi
283,happy,well deserv congratul
284,nocode,would say come see christoph william close sunday
285,happy,spend sunday morn roam indigen australia exhibit
286,nocode,mysteri tweet identifi ancient greek bronz greav bc genuin confus
287,not-relevant,thing london today take action end scam lie auster endausteritynow
288,nocode,glimps tiepolo inner world merchant light new histor novel marta maretich
289,nocode,beatric gibson sarah turner larissa sansour present materi inspir work bk
290,happy,hadrian visit wall next w zada beda thank
291,nocode,look pictur matan ben cnaan winner year bp competit
292,happy,good paint
293,happy,thank dian presenc contribut much appreci striker
294,happy,went defin beauti exhibit yesterday thought tweet muse
295,nocode,nap iii pari mean
296,happy,ahah place spent saturday sunday wokhingham school made card
297,angry,striker sponsor protest privatis kayaktivist shellno
298,nocode,last week defin beauti
299,not-relevant,forget level subject taster week come septemb across book free place today
300,nocode,burn question director nichola penni chanc ask askthegalleri
301,nocode,fathihassan theoffer photograph photographi photographycollect
302,happy,gorgeou
303,nocode,look thrill
304,happy,summer art happen audrey hepburn barbara hepworth summer exhibit pollock happi day
305,happy,thank
306,nocode,everi good painter paint jackson pollock come soon
307,happy,complet week dose ancient greec night definingbeauti expo quit spectacl busi worth see
308,nocode,tonight pm discus collag contemporari art brooklynvslondon exhibit
309,happy,privateview open new baroqu galleri amaz
310,nocode,contemporari ad christoph william
311,nocode,send cv
312,nocode,c mon could anybodi
313,happy,heard soundscap hint paint dj museum pretti cool
314,nocode,cover ulyss nya joyc karya matiss
315,nocode,muy propio para hoy visto mucho san juanito hoy por la call de bejar
316,nocode,u fit charact learn abt waterloo signific taken curriculum nj like chang
317,nocode,et sandro aussi venu mar botticelli
318,nocode,wimbledon start today one tenni
319,disgust|angry,hous solut propos meet flexibl need come time talk
320,nocode,listen germani memori nation podcast mani show effort grappl brutal histori
321,nocode,broke broke lute
322,happy,look forward age friendli museum network tomorrow present partnership
323,nocode,london greater london
324,nocode,napoleon china art london ttot lp vacat trip photographi photo travel travelp
325,nocode,superstit religion leaf clover enclos thoma becket pilgrimbadg
326,nocode,win ticket jackson pollock blind spot pair giveaway art liverpool comp
327,nocode,none
328,nocode,magic carpet storytel
329,happy,thank rt follow back great see panelist action defeatingdepress
330,nocode,check art corner queen squar weekend
331,nocode,ted w british museum collect imag galleri
332,nocode,none
333,nocode,none
334,nocode,rayban outlet click
335,nocode,form process context space meet point histori artist sarah turner convers w karen mirza
336,nocode,job desc model back today african rock art team
337,not-relevant,bonapart import napoleon egyptian cultur
338,nocode,london greater london w
339,nocode,cup depict odysseu rather sad achil via archiv
340,nocode,explor art castl hill sat tour new hall art collect last chanc visit
341,happy,read mega pollock certainli perk morn commut
342,nocode,told dropbp sponsorship join
343,happy,one room ravin neuenschwand well worth visit u becom part
344,happy,fantast introduct display baroqu galleri today pre european paint ssn studi day
345,not-relevant,rt hi check crowdfund campaign pauser help u creat new graffiti streetart
346,not-relevant,rd genocid biafran promis buhari begun day unreport aerial bombard biafraland
347,happy,would love know sourc
348,happy,express gratitud visit insid art histori textbk w
349,nocode,miss christoph william exhibit photographi britaininsid
350,nocode,sincru annual hiphop theatr summer show silent step take place st weekend juli
351,nocode,pejor comment class
352,happy,enjoy van gogh live short wrote walk thame work
353,nocode,real life iron throne gameofthron got
354,nocode,john h taylor du collect activ giovanni athanasi objetegyptien
355,nocode,tri creat fun palac across bath bring scienc art togeth interest
356,happy,london awesom
357,happy,much better
358,nocode,none
359,nocode,morn student given free time explor cambridg museum exploreyoursubject swopenday
360,nocode,none
361,happy,funni fast talk mc great night beauti venu
362,happy,cannot believ year london first visit british museum massiv
363,happy,ye excit complet epic tippett cycl tomorrow even
364,nocode,win pair ticket jackson pollock blind spot art exhibit liverpool
365,nocode,mirror imag friez monoprint
366,not-relevant,hi pl share sponsor roman road walk follow
367,nocode,blind spot explor jackson pollock black pour open june
368,happy,new follow thank favourit rt realli interest panel defeatingdepress
369,nocode,askthegalleri would better adapt need foreign visitor
370,not-relevant,thank rt hope one day soon work
371,nocode,tomorrow histori art scienc collid fellowfriday hope join u
372,not-relevant,sexi porn sex danc sexual intercour
373,nocode,got spare fiver almost reach redevelop fund target
374,nocode,discov art social medium noho featur artist natali ryde london art video
375,nocode,christoph william product line happi show till june
376,disgust,oh get ed interven librari cut
377,happy,fantast thank
378,happy,toward parliament squar dusk hope enjoy paint
379,happy,dartmouth museum daili stori via
380,happy,may bought stuff mexican bit
381,happy|surprise,saw london last year look sign damag saw none conservationist deserv merit
382,nocode,apotropa rt today mysteryobject ancient greek bronz greav bc
383,happy,go week
384,nocode,hello interest kundalini enlighten liber etc check
385,nocode,la gare saint lazar de claud monet london
386,happy,rt touch diari trailer premier th juli
387,nocode,enlighten galleri kind batman begin place
388,nocode,ceo daniel gandesha speak money startup event th juli
389,happy,christopherwilliam product line happi sunday dynam refresh
390,happy,fab
391,nocode,head visit mummi statu
392,happy,dr sculthorp provid insight talk member indigenousaustralia exhibit
393,happy,exet definit worth visit samurai ilovemuseum
394,happy,visit today inspir everywher
395,happy,f funki fiddl leaf also fabul
396,not-relevant,truth brain freez rememb name
397,happy,brilliant day love drink much coffe love
398,happy,find great content produc periscop like
399,nocode,entranc hall royal academi somerset hous georg johann scharf
400,happy,congrat v excit look forward show start th juli miss
401,nocode,lo vist el tuit popular de hoy entr la persona que sigo por
402,happy,sparkl string light ad ambienc kettl yard sunni afternoon
403,happy,great c rembrandt back loan room miss much
404,nocode,cross red line cambridgeunivers iphoneonli shotoniphon museum
405,happy,pollock review art nervou breakdown majest via octob
406,nocode,friday christoph william whitechapelgalleri
407,happy,great visit yesterday expect photo
408,nocode,student got tri hand curat exhibit yesterday check
409,happy,great day film roman gem watch space finish video
410,not-relevant,director nichola penni candi udwin sack vocal torus plan askthegalleri
411,nocode,look incred uncomfort wear
412,nocode,coin mint amphipoli greec bc depict zeu today
413,nocode,glass mean fragil book fortif plan say museum text tizian far superior
414,happy,hammer door see exhibit fantast opportun see well curat exhibit
415,happy,look forward join even defeatingdepress event host
416,happy,love draw silver gold exhibit fascin process breadth use thru centuri art
417,happy,plea select galleri juli august evolverpr
418,happy,saw definingbeauti today gloriou serious ar exhibit wow
419,nocode,cezann paint leav cambridg unless uk buyer come forward
420,nocode,tom
421,nocode,come soon near
422,happy,thank carolin campbel aft glad came london take
423,nocode,e g arc de triomph part louvr napoleon b
424,nocode,van gogh monet london
425,happy,britishmuseum rt love ancientl exhibit brilliant use technolog amazin
426,happy,wonder summer parti
427,surprise,death mask
428,nocode,matt morgan explor display light art turner eliasson later pm alsofestiv
429,angry,solidar kayaktivist r fight want privatis worker shellno noprivatis
430,nocode,put ahead howev fear chang come
431,happy,realli love definingbeauti outstand exhibit worth last sculptur alon close juli
432,nocode,discov diver
433,nocode,still time book newexpress fieldvisit keithharrison philipeglin
434,happy,sound wonder enjoy
435,happy,realli enjoy tweet well worth follow
436,happy,finish deinstal close year redevelop look forward see new space
437,nocode,wound eye horu use much
438,nocode,fathersday father carl kohler selfportrait
439,happy,ace dragon tile
440,nocode,l immens toil majeur de seurat mal connu en franc baigneur asni re est londr
441,happy,thank preserv palmyr
442,happy,welcom aboard
443,nocode,curat laura smith talk show virginia woolf woman artist materialhistori
444,nocode,alway start perugino tri stuff
445,happy,rather love promot anim
446,nocode,lie beneath draperi suggest form via
447,nocode,dutch hors surviv
448,happy,congratul traine fantast baroqu redisplay
449,happy,glad day lovewin
450,happy,love periscop broadcast sideway though might browser
451,nocode,still open anoth hour plea come visit u castlehil
452,happy,superb mu e
453,happy,love place
454,nocode,also invit local wit forum publicli ok alway like vespasian
455,nocode,askthegalleri dear director realli would like know
456,nocode,look perform castlehil open day saturday th june danc bboy info
457,not-relevant,ff
458,nocode,extens
459,nocode,th june transform museum thing art
460,nocode,saturday screen discus w beatric gibson sarah turner larissa sansour
461,nocode,crocodil mask indigeousaustralia exhibit
462,not-relevant,rd genocid biafran promis buhari begun day unreport aerial bombard biafraland
463,happy,usa armchair travel see impressionist nation galleri juli th
464,nocode,askthegalleri dear director realli need know
465,happy,thank love even
466,happy,thank
467,happy,beauti beauti hard come day
468,nocode,review christoph william product line happi til text becki syke
469,not-relevant,suppli core colour point wireless pa system eventprof
470,nocode,da ist auch leider die kultur und sprachpolitik im ausland schuld kurz bratwurst statt kultur
471,nocode,london greater london
472,nocode,paint arm deiti yama deva stand bull hold sun moon china tang dyn c
473,happy,moon present new websit local award win art galleri honiton
474,nocode,none
475,nocode,japan art london ttot lp vacat trip photographi photo travel travelp
476,not-relevant,follow
477,happy,fantast close exhibit provid inspir draw sculptur new rhythm
